Link,Judul,Kecamatan,Lahan Parkir,Kamar Tidur,Kamar Mandi,Luas Bangunan,Luas Tanah,Harga
https://www.lamudi.co.id/jual/jawa-barat/bandung/rumah-terawat-siap-huni-pinus-regency-arcamanik-172239446534/,Rumah Terawat Siap Huni Pinus Regency Arcamanik,Arcamanik,2,4,3,92,189,Rp1.700.000.000
https://www.lamudi.co.id/jual/jawa-barat/bandung/rumah-bagus-shm-di-cisaranten-arcamanik-bandung-172239277269/,"Rumah Bagus SHM di Cisaranten Arcamanik, Bandung",Arcamanik,1,2,1,50,100,Rp750.000.000
https://www.lamudi.co.id/jual/jawa-barat/bandung/rumah-baru-minimalis-permata-elok-arcamanik-172235995033/,Rumah Baru Minimalis Permata Elok Arcamanik,Arcamanik,1,4,2,110,143,Rp1.050.000.000
https://www.lamudi.co.id/jual/jawa-barat/bandung/rumah-hitung-tanah-minimalis-di-arcamanik-172234327750/,Rumah Hitung Tanah Minimalis Di ARCAMANIK,Arcamanik,,4,2,85,135,Rp1.000.000.000
https://www.lamudi.co.id/jual/jawa-barat/bandung/di-jual-rumah-minimalis-di-cisaranten-kulon-arcama-172233600539/,DI JUAL RUMAH MINIMALIS DI CISARANTEN KULON ARCAMANIK,Arcamanik,,2,2,60,100,Rp700.000.000
https://www.lamudi.co.id/jual/jawa-barat/bandung/rumah-lama-minimalis-di-arcamanik-172232863599/,Rumah Lama Minimalis Di Arcamanik,Arcamanik,,4,2,85,133,Rp1.000.000.000
https://www.lamudi.co.id/jual/jawa-barat/bandung/rumah-5-kamar-tidur-terawat-di-arcamanik-dijual-mu-172231437037/,Rumah 5 kamar Tidur terawat di Arcamanik dijual Murah,Arcamanik,2,5,2,120,187,Rp1.700.000.000
https://www.lamudi.co.id/jual/jawa-barat/bandung/rumah-murah-2-lantai-siap-huni-di-cisaranten-arcam-172231176646/,Rumah Murah 2 Lantai Siap Huni Di Cisaranten Arcamanik Harga di Bawah,Arcamanik,1,2,2,75,100,Rp850.000.000
https://www.lamudi.co.id/jual/jawa-barat/bandung/jual-cepat-dibawah-hrg-pasar-rumah-di-arcamanik-ba-172230914040/,Jual cepat dibawah hrg pasar rumah di Arcamanik Bandung,Arcamanik,1,2,2,172,285,Rp2.200.000.000
https://www.lamudi.co.id/jual/jawa-barat/bandung/rumah-siap-huni-arcamanik-2-lantai-nyaman-172227077268/,Rumah Siap Huni Arcamanik 2 lantai Nyaman,Arcamanik,,4,2,220,120,Rp1.300.000.000
https://www.lamudi.co.id/jual/jawa-barat/bandung/dijual-cepat-rumah-minimalis-terawat-arcamanik-172226527681/,Dijual Cepat Rumah Minimalis Terawat Arcamanik,Arcamanik,,4,2,85,133,Rp1.000.000.000
https://www.lamudi.co.id/jual/jawa-barat/bandung/ready-stock-rumah-di-kota-bandung-172225986863/,Ready Stock Rumah Di Kota Bandung,Arcamanik,,2,1,58,83,Rp691.000.000
https://www.lamudi.co.id/jual/jawa-barat/bandung/rumah-murah-asri-di-mitra-dago-parahyangan-antapan-172223802717/,"Rumah murah asri di mitra dago parahyangan, antapani",Arcamanik,2,5,3,200,216,Rp2.560.000.000
https://www.lamudi.co.id/jual/jawa-barat/bandung/rumah-baru-siap-huni-di-arcamanik-kota-bandung-dek-172222789474/,RUMAH BARU SIAP HUNI DI ARCAMANIK KOTA BANDUNG DEKAT SPORT JABAR,Arcamanik,,5,4,170,133,Rp1.850.000.000
https://www.lamudi.co.id/jual/jawa-barat/bandung/dijual-rumah-murah-2-lantai-dekat-bandung-city-vie-172222604473/,Dijual Rumah murah  2 lantai dekat Bandung city view Pasir impun,Arcamanik,2,4,2,250,125,Rp665.000.000
https://www.lamudi.co.id/jual/jawa-barat/bandung/siap-huni-rumah-mewah-kota-bandung-172217343810/,Siap Huni Rumah Mewah Kota Bandung,Arcamanik,,4,3,93,85,Rp1.050.000.000
https://www.lamudi.co.id/jual/jawa-barat/bandung/rumah-nyaman-di-jl-ice-skating-arcamanik-172217241570/,Rumah Nyaman di Jl Ice Skating Arcamanik,Arcamanik,,4,2,220,120,Rp1.300.000.000
https://www.lamudi.co.id/jual/jawa-barat/bandung/rumah-mewah-harga-murah-siap-huni-di-bandung-perum-172214085842/,"Rumah Mewah harga Murah Siap Huni di Bandung, Perumahan Edelweis",Arcamanik,6,3,3,120,70,Rp975.000.000
https://www.lamudi.co.id/jual/jawa-barat/bandung/rumah-dalam-cluster-arcamanik-endah-17220903944/,Rumah Dalam  Cluster  Arcamanik Endah,Arcamanik,,5,2,150,256,Rp1.900.000.000
https://www.lamudi.co.id/jual/jawa-barat/bandung/rumah-baru-scandinavian-bandung-kota-172208576266/,Rumah Baru Scandinavian Bandung Kota,Arcamanik,,2,2,61,62,Rp794.990.000
https://www.lamudi.co.id/jual/jawa-barat/bandung/di-jual-rumah-minimalis-di-ciskul-1-arcamanik-172205539850/,DI JUAL RUMAH MINIMALIS DI CISKUL 1 ARCAMANIK,Arcamanik,,4,2,100,96,Rp1.100.000.000
https://www.lamudi.co.id/jual/jawa-barat/bandung/di-jual-rumah-minimalis-2-lantai-di-permata-inten-172205540128/,DI JUAL RUMAH MINIMALIS 2 LANTAI DI PERMATA INTEN ARCAMANIK,Arcamanik,,3,2,100,120,Rp1.100.000.000
https://www.lamudi.co.id/jual/jawa-barat/bandung/rumah-cantik-di-cisaranten-arcamanik-bandung-172198648818/,Rumah Cantik di Cisaranten Arcamanik Bandung,Arcamanik,,3,2,73,106,Rp1.350.000.000
https://www.lamudi.co.id/jual/jawa-barat/bandung/rumah-mewah-furnished-di-cisaranten-arcamanik-kota-17219667116/,RUMAH MEWAH FURNISHED DI CISARANTEN ARCAMANIK KOTA BANDUNG,Arcamanik,,3,2,150,155,Rp2.200.000.000
https://www.lamudi.co.id/jual/jawa-barat/bandung/ready-stock-cisaranten-bandung-172191325556/,Ready Stock Cisaranten Bandung,Arcamanik,,2,1,46,67,Rp589.995.000
https://www.lamudi.co.id/jual/jawa-barat/bandung/jual-cepat-rumah-minimalis-di-mulya-golf-arcamanik-172190752692/,JUAL CEPAT RUMAH MINIMALIS DI MULYA GOLF ARCAMANIK CISARANTEN,Arcamanik,2,2,1,80,96,Rp820.000.000
https://www.lamudi.co.id/jual/jawa-barat/bandung/dijual-cepat-rumah-terawat-2-lantai-dekat-terminal-172292085098/,Dijual Cepat Rumah Terawat  2 Lantai Dekat Terminal Antapani Bandung,Arcamanik,,7,5,200,300,Rp2.600.000.000
https://www.lamudi.co.id/jual/jawa-barat/bandung/dijual-rumah-jl-aeromodelling-arcamanik-bandung-172189502182/,Dijual Rumah Jl. Aeromodelling Arcamanik Bandung,Arcamanik,,4,3,176,176,Rp1.800.000.000
https://www.lamudi.co.id/jual/jawa-barat/bandung/rumah-dalam-cluster-arcamanik-17218927134/,Rumah Dalam Cluster Arcamanik,Arcamanik,,2,1,80,113,Rp1.200.000.000
https://www.lamudi.co.id/jual/jawa-barat/bandung/rumah-minimalis-bagus-terawat-puri-dago-antapani-b-172189147581/,Rumah minimalis bagus terawat Puri dago antapani Bandung.Strategis,Arcamanik,,2,2,84,108,Rp1.299.000.000
https://www.lamudi.co.id/jual/jawa-barat/bandung/dijual-rumah-cluster-baru-mewah-5-unit-di-arcamani-17218888768/,DIJUAL RUMAH CLUSTER BARU MEWAH 5 UNIT DI ARCAMANIK KOTA BANDUNG,Arcamanik,,2,2,62,63,Rp795.000.000
https://www.lamudi.co.id/jual/jawa-barat/bandung/dijual-rumah-arcamanik-bandung-172188298722/,Dijual Rumah Arcamanik Bandung,Arcamanik,,3,3,100,100,Rp1.150.000.000
https://www.lamudi.co.id/jual/jawa-barat/bandung/dijual-rumah-baru-edelweiss-jl-cisaranten-kulon-ba-172188057692/,"Dijual Rumah Baru Edelweiss 
Jl.Cisaranten Kulon Bandung",Arcamanik,,3,3,120,70,Rp975.000.000
https://www.lamudi.co.id/jual/jawa-barat/bandung/rumah-2lt-scandinavian-arcamanik-172183931239/,Rumah 2lt Scandinavian Arcamanik,Arcamanik,,2,2,62,63,Rp795.000.000
https://www.lamudi.co.id/jual/jawa-barat/bandung/dijual-cepat-rumah-baru-di-cisaranten-arcamanik-de-172180709288/,dijual Cepat Rumah Baru di Cisaranten Arcamanik dekat Griya Murah,Arcamanik,1,2,1,40,72,Rp580.000.000
https://www.lamudi.co.id/jual/jawa-barat/bandung/rumah-nyaman-siap-huni-di-golf-barat-arcamanik-ban-172180592432/,"Rumah nyaman siap huni di golf barat, arcamanik - bandung",Arcamanik,5,6,7,300,320,Rp3.750.000.000
https://www.lamudi.co.id/jual/jawa-barat/bandung/rumah-murah-minimalis-di-puri-ayu-arcamanik-dkt-an-172180338827/,Rumah Murah Minimalis di Puri Ayu Arcamanik Dkt Antap Bandung,Arcamanik,1,4,3,200,128,Rp1.575.000.000
https://www.lamudi.co.id/jual/jawa-barat/bandung/jual-cepat-rumah-murah-di-puri-ayu-arcamanik-dekat-172180291329/,Jual Cepat Rumah Murah di Puri Ayu Arcamanik Dekat Antapani Bandung,Arcamanik,1,4,3,200,128,Rp1.575.000.000
https://www.lamudi.co.id/jual/jawa-barat/bandung/jual-cepat-rumah-murah-di-puri-ayu-arcamanik-dekat-17218020171/,Jual Cepat Rumah Murah di Puri Ayu Arcamanik Dekat Antapani Bandung,Arcamanik,1,4,3,200,128,Rp1.575.000.000
https://www.lamudi.co.id/jual/jawa-barat/bandung/rumah-arcamanik-recommended-172179501661/,Rumah arcamanik. Recommended,Arcamanik,1,2,1,40,70,Rp650.000.000
https://www.lamudi.co.id/jual/jawa-barat/bandung/rumah-siap-huni-minimalis-komplek-arcamanik-172174726736/,Rumah Siap Huni Minimalis Komplek Arcamanik,Arcamanik,,3,2,120,151,Rp1.800.000.000
https://www.lamudi.co.id/jual/jawa-barat/bandung/rumah-murah-minimalis-komplek-cisaranten-arcamanik-17217414581/,Rumah Murah Minimalis Komplek Cisaranten Arcamanik,Arcamanik,,3,2,95,95,Rp900.000.000
https://www.lamudi.co.id/jual/jawa-barat/bandung/rumah-cisaranten-arcamanik-harga-dibawah-harga-pas-172173526847/,Rumah cisaranten Arcamanik harga dibawah harga pasaran,Arcamanik,1,2,2,75,100,Rp850.000.000
https://www.lamudi.co.id/jual/jawa-barat/bandung/rumah-siap-huni-bagus-arcamanik-ada-taman-dkt-spor-172171378766/,RUMAH SIAP HUNI BAGUS ARCAMANIK ADA TAMAN DKT SPORT JABAR -amh,Arcamanik,1,5,4,200,220,Rp2.600.000.000
https://www.lamudi.co.id/jual/jawa-barat/bandung/rumah-baru-on-progres-di-cisaranten-arcamanik-kota-172171270076/,RUMAH BARU ON PROGRES DI CISARANTEN ARCAMANIK KOTA BANDUNG,Arcamanik,,2,1,48,72,Rp580.000.000
https://www.lamudi.co.id/jual/jawa-barat/bandung/dijual-rumah-nyaman-di-aeromodeling-arcamanik-172170935893/,Dijual Rumah Nyaman di Aeromodeling Arcamanik,Arcamanik,,3,3,180,200,Rp2.750.000.000
https://www.lamudi.co.id/jual/jawa-barat/bandung/dijual-rumah-nyaman-di-aeromodeling-arcamanik-172170919584/,Dijual Rumah Nyaman di Aeromodeling Arcamanik,Arcamanik,,1,1,180,200,Rp2.750.000.000
https://www.lamudi.co.id/jual/jawa-barat/bandung/rumah-dijual-murah-di-cisaranten-kulon-arcamanik-d-172169100314/,Rumah dijual Murah di Cisaranten Kulon Arcamanik Dkt Al-Ghifari,Arcamanik,,3,2,75,96,Rp710.000.000
https://www.lamudi.co.id/jual/jawa-barat/bandung/rumah-murah-di-cijambe-172166827092/,rumah murah di cijambe,Arcamanik,1,2,2,75,110,Rp1.200.000.000
https://www.lamudi.co.id/jual/jawa-barat/bandung/rumah-hoek-kamayangan-residence-arcamanik-dkt-anta-172165837164/,Rumah hoek kamayangan residence arcamanik dkt antapani,Arcamanik,15,3,2,75,109,Rp850.000.000
https://www.lamudi.co.id/jual/jawa-barat/bandung/rumah-mbv-jatihandap-siap-huni-2-lantai-di-mandala-172165516136/,"Rumah MBV Jatihandap, SIAP HUNI, 2 LANTAI di Mandalajati Bandung Timur",Arcamanik,2,2,2,72,80,Rp696.000.000
https://www.lamudi.co.id/jual/jawa-barat/bandung/rumah-2-lantai-bagus-shm-di-arcamanik-bandung-172164729834/,"Rumah 2 Lantai Bagus SHM di Arcamanik, Bandung",Arcamanik,1,3,2,133,209,Rp1.350.000.000
https://www.lamudi.co.id/jual/jawa-barat/bandung/rumah-2-lt-shm-on-progres-di-arcamanik-kota-bandun-172164286890/,RUMAH 2 LT SHM ON PROGRES DI ARCAMANIK KOTA BANDUNG,Arcamanik,,3,2,75,113,Rp950.000.000
https://www.lamudi.co.id/jual/jawa-barat/bandung/rumah-hook-murah-dijual-cepat-harga-bawah-njop-arc-172154087470/,RUMAH HOOK MURAH DIJUAL CEPAT HARGA BAWAH NJOP ARCAMANIK TANAH LUAS,Arcamanik,,3,2,160,327,Rp1.600.000.000
https://www.lamudi.co.id/jual/jawa-barat/bandung/rumah-minimalis-di-cisaranten-kulon-172153334412/,rumah minimalis di cisaranten kulon,Arcamanik,,3,2,140,85,Rp1.100.000.000
https://www.lamudi.co.id/jual/jawa-barat/bandung/rumah-siap-huni-arcamanik-endah-172149118755/,Rumah Siap Huni Arcamanik Endah,Arcamanik,,2,2,80,120,Rp975.000.000
https://www.lamudi.co.id/jual/jawa-barat/bandung/rumah-minimalis-siap-huni-cisaranten-kulon-arcaman-172147060732/,"Rumah Minimalis Siap Huni Cisaranten Kulon, Arcamanik Unfurnish",Arcamanik,,2,1,45,108,Rp700.000.000
https://www.lamudi.co.id/jual/jawa-barat/bandung/siap-huni-cisaranten-bandung-17213947962/,Siap Huni Cisaranten Bandung,Arcamanik,,2,2,55,63,Rp790.000.000
https://www.lamudi.co.id/jual/jawa-barat/bandung/dijual-murah-rumah-minimalis-nyaman-terawat-di-say-172137941376/,Dijual Murah Rumah Minimalis Nyaman Terawat di Sayap Arcamanik Bandung,Arcamanik,,2,1,45,108,Rp775.000.000
https://www.lamudi.co.id/jual/jawa-barat/bandung/dijual-rumah-hoek-luas-nyaman-terawat-di-arcamanik-172137913755/,Dijual Rumah Hoek Luas Nyaman Terawat di Arcamanik Bandung,Arcamanik,,4,2,153,184,Rp1.500.000.000
https://www.lamudi.co.id/jual/jawa-barat/bandung/rumah-cisaranten-kulon-arcamanik-17213760878/,Rumah Cisaranten kulon Arcamanik,Arcamanik,,5,3,154,120,Rp1.500.000.000
https://www.lamudi.co.id/jual/jawa-barat/bandung/dijual-rumah-baru-di-cisaranten-arcamanik-172129178396/,Dijual Rumah baru di Cisaranten Arcamanik,Arcamanik,,3,3,100,170,Rp1.200.000.000
https://www.lamudi.co.id/jual/jawa-barat/bandung/rumah-minimalis-murah-komplek-cinambo-cisaranten-172122633510/,Rumah Minimalis Murah Komplek Cinambo Cisaranten,Arcamanik,,3,1,85,100,Rp750.000.000
https://www.lamudi.co.id/jual/jawa-barat/bandung/rumah-murah-arcamanik-bandung-kota-4-kamar-tidur-s-172121215988/,RUMAH MURAH ARCAMANIK BANDUNG KOTA 4 KAMAR TIDUR SHM DISKON 120JT,Arcamanik,,4,2,85,92,Rp980.000.000
https://www.lamudi.co.id/jual/jawa-barat/bandung/rumah-minimalis-siap-huni-di-kompleks-arcamanik-pe-172120291132/,Rumah Minimalis Siap Huni di Kompleks Arcamanik Permata Taman Sari,Arcamanik,,2,2,52,87,Rp680.000.000
https://www.lamudi.co.id/jual/jawa-barat/bandung/jual-cepat-rumah-minimalis-siap-huni-arcamanik-172119814526/,Jual cepat Rumah minimalis siap huni arcamanik,Arcamanik,,2,2,52,87,Rp680.000.000
https://www.lamudi.co.id/jual/jawa-barat/bandung/jual-murah-di-bawah-pasar-rm-lt118-150-di-cisarant-172119458930/,jual murah di bawah pasar rm lt118/150 di cisaranten arcamanik bandung,Arcamanik,1,4,3,160,118,Rp775.000.000
https://www.lamudi.co.id/jual/jawa-barat/bandung/rumah-murah-arcamanik-endah-kota-bandung-17211919966/,Rumah Murah Arcamanik Endah Kota Bandung,Arcamanik,2,3,2,100,176,Rp1.200.000.000
https://www.lamudi.co.id/jual/jawa-barat/bandung/rumah-siap-huni-dalam-cluster-di-arcamanik-nego-sa-172118500228/,Rumah siap huni dalam cluster di Arcamanik nego sampai jadi,Arcamanik,,3,2,85,140,Rp1.100.000.000
https://www.lamudi.co.id/jual/jawa-barat/bandung/rumah-minimalis-murah-cisaranten-kulon-arcamanik-172114410798/,Rumah Minimalis Murah Cisaranten Kulon Arcamanik,Arcamanik,,3,2,78,98,Rp794.000.000
https://www.lamudi.co.id/jual/jawa-barat/bandung/rumah-minimalis-murah-komplek-arcamanik-endah-172114327242/,Rumah Minimalis Murah Komplek Arcamanik Endah,Arcamanik,,3,2,120,143,Rp1.300.000.000
https://www.lamudi.co.id/jual/jawa-barat/bandung/rumah-2-lantai-siap-huni-di-cisaranten-kulon-arcam-172103692227/,Rumah 2 Lantai Siap Huni di Cisaranten Kulon Arcamanik Kota Bandung,Arcamanik,,4,2,120,114,Rp1.500.000.000
https://www.lamudi.co.id/jual/jawa-barat/bandung/rumah-shm-murah-di-komplek-bukit-pajajaran-pasir-i-172103464014/,"Rumah shm murah di komplek bukit pajajaran, pasir impun",Arcamanik,2,4,1,100,125,Rp600.000.000
https://www.lamudi.co.id/jual/jawa-barat/bandung/rumah-free-desain-cisaranten-arcamanik-kota-bandun-172102919629/,Rumah free desain cisaranten arcamanik kota bandung,Arcamanik,15,2,1,40,72,Rp630.000.000
https://www.lamudi.co.id/jual/jawa-barat/bandung/dijual-rumah-lux-siap-huni-panorama-alam-parahyang-172101871048/,Dijual rumah lux siap huni Panorama Alam Parahyangan,Arcamanik,,5,5,300,240,Rp3.500.000.000
https://www.lamudi.co.id/jual/jawa-barat/bandung/rumah-lingkungan-nyaman-di-cijambe-ubertos-mall-ar-17210080873/,Rumah Lingkungan NYAMAN di Cijambe Ubertos Mall Arcamanik dijual,Arcamanik,,2,1,48,84,Rp680.000.000
https://www.lamudi.co.id/jual/jawa-barat/bandung/dijual-cepat-rumah-nyaman-komplek-bumi-parakan-asr-172096662998/,Dijual Cepat Rumah Nyaman Komplek Bumi Parakan Asri,Arcamanik,2,4,2,100,142,Rp999.000.000
https://www.lamudi.co.id/jual/jawa-barat/bandung/dijual-rumah-cantik-asri-di-arcamanik-pacuan-kuda-172091074558/,Dijual Rumah Cantik & Asri Di Arcamanik Pacuan Kuda,Arcamanik,,3,1,80,140,Rp1.275.000.000
https://www.lamudi.co.id/jual/jawa-barat/bandung/dijual-rumah-furnished-cisaranten-kulon-172089033160/,Dijual Rumah Furnished Cisaranten Kulon,Arcamanik,1,2,1,50,88,Rp750.000.000
https://www.lamudi.co.id/jual/jawa-barat/bandung/rumah-guruminda-arcamanik-jual-cepat-via-lelang-172088068059/,Rumah Guruminda Arcamanik Jual Cepat Via Lelang,Arcamanik,,3,2,120,152,Rp540.000.000
https://www.lamudi.co.id/jual/jawa-barat/bandung/turun-harga-rumah-nyaman-siap-huni-arcamanik-172086497886/,Turun Harga Rumah Nyaman Siap Huni Arcamanik,Arcamanik,,4,3,140,169,Rp1.900.000.000
https://www.lamudi.co.id/jual/jawa-barat/bandung/rumah-bagus-siap-huni-di-cisaranten-arcamanik-172086152553/,Rumah Bagus Siap Huni di Cisaranten Arcamanik,Arcamanik,1,3,2,83,100,Rp1.100.000.000
https://www.lamudi.co.id/jual/jawa-barat/bandung/rumah-murah-jual-cepat-siap-huni-di-arcamanik-band-172085660946/,Rumah Murah Jual Cepat  Siap Huni di Arcamanik Bandung,Arcamanik,1,3,2,80,105,Rp875.000.000
https://www.lamudi.co.id/jual/jawa-barat/bandung/rumah-minimalis-siap-huni-arcamanik-endah-172119668744/,Rumah Minimalis Siap Huni Arcamanik Endah,Arcamanik,,3,4,140,169,Rp1.900.000.000
https://www.lamudi.co.id/jual/jawa-barat/bandung/rumah-minimalis-indent-cisaranten-kulon-arcamanik-172084106642/,Rumah Minimalis Indent Cisaranten Kulon Arcamanik,Arcamanik,,2,1,40,72,Rp630.000.000
https://www.lamudi.co.id/jual/jawa-barat/bandung/rumah-minimalis-terawat-dengan-lingkungan-nyaman-d-172080254255/,Rumah Minimalis terawat Dengan lingkungan Nyaman Dan Sejuk,Arcamanik,2,3,2,190,160,Rp1.900.000.000
https://www.lamudi.co.id/jual/jawa-barat/bandung/rumah-mbv-jatihandap-siap-huni-2-lantai-di-mandala-172080251492/,"Rumah MBV Jatihandap, SIAP HUNI, 2 LANTAI di Mandalajati Bandung Timur",Arcamanik,2,3,2,72,80,Rp696.000.000
https://www.lamudi.co.id/jual/jawa-barat/bandung/rumah-murah-di-arcamanik-172079968835/,rumah murah di arcamanik,Arcamanik,1,3,3,135,96,Rp1.197.000.000
https://www.lamudi.co.id/jual/jawa-barat/bandung/rumah-bagus-arcamanik-murah-172077875663/,Rumah bagus Arcamanik. murah,Arcamanik,,2,1,50,70,Rp650.000.000
https://www.lamudi.co.id/jual/jawa-barat/bandung/rumah-baru-minimalis-cisaranten-kulon-arcamanik-17207583825/,Rumah Baru Minimalis Cisaranten Kulon Arcamanik,Arcamanik,,4,3,120,70,Rp975.000.000
https://www.lamudi.co.id/jual/jawa-barat/bandung/rumah-terawat-kamar-banyak-di-arcamanik-bandung-di-172074745410/,Rumah TERAWAT KAMAR BANYAK di Arcamanik Bandung di jual,Arcamanik,,4,2,120,114,Rp1.500.000.000
https://www.lamudi.co.id/jual/jawa-barat/bandung/dijual-rumah-di-arcamanik-endah-172068058364/,Dijual Rumah di Arcamanik Endah,Arcamanik,,5,2,140,88,Rp1.200.000.000
https://www.lamudi.co.id/jual/jawa-barat/bandung/jual-cepat-rumah-murah-arcamanik-172062273759/,Jual Cepat Rumah Murah Arcamanik,Arcamanik,,3,2,100,176,Rp1.200.000.000
https://www.lamudi.co.id/jual/jawa-barat/bandung/rumah-desain-modern-baru-di-arcamanik-bandung-siap-172061357125/,Rumah DESAIN MODERN BARU di Arcamanik Bandung SIAP HUNI dijual,Arcamanik,,5,4,170,133,Rp1.850.000.000
https://www.lamudi.co.id/jual/jawa-barat/bandung/rumah-murah-di-arcamanik-172060898659/,rumah murah di arcamanik,Arcamanik,1,3,3,140,176,Rp1.750.000.000
https://www.lamudi.co.id/jual/jawa-barat/bandung/rumah-luas-carport-luas-murah-bawah-njop-arcamanik-172061347769/,Rumah LUAS CARPORT LUAS MURAH bawah NJOP ARCAMANIK Bandung dijual,Arcamanik,,5,3,450,600,Rp3.600.000.000
https://www.lamudi.co.id/jual/jawa-barat/bandung/dijual-rumah-dan-usaha-kost-aktif-full-terisi-di-a-17206005807/,Dijual Rumah dan Usaha Kost Aktif Full Terisi di Arcamanik Bandung,Arcamanik,,9,9,209,136,Rp2.000.000.000
https://www.lamudi.co.id/jual/jawa-barat/bandung/rumah-modern-ekslusif-model-tropical-di-arcamanik-172061376415/,Rumah modern ekslusif model tropical di Arcamanik Bandung.Strategis,Arcamanik,,2,1,50,45,Rp830.000.000
https://www.lamudi.co.id/jual/jawa-barat/bandung/dijual-cepat-rumah-siap-huni-lingkungan-aman-172059404174/,Dijual Cepat Rumah Siap Huni Lingkungan Aman,Arcamanik,1,3,3,150,102,Rp1.375.000.000
https://www.lamudi.co.id/jual/jawa-barat/bandung/rumah-murah-cisaranten-arcamanik-kota-bandung-17205939567/,Rumah murah cisaranten arcamanik kota bandung,Arcamanik,30,4,3,150,118,Rp875.000.000
https://www.lamudi.co.id/jual/jawa-barat/bandung/dijual-rumah-siap-huni-komplek-arcamanik-endah-ban-172058552191/,Dijual rumah siap huni komplek Arcamanik Endah Bandung lingkungan OKE,Arcamanik,1,3,1,120,99,Rp995.000.000
https://www.lamudi.co.id/jual/jawa-barat/bandung/murah-rumah-besar-di-jl-bulutangkis-arcamanik-172055184034/,Murah Rumah Besar di Jl Bulutangkis Arcamanik,Arcamanik,,7,4,305,312,Rp1.700.000.000
https://www.lamudi.co.id/jual/jawa-barat/bandung/dijual-cepat-rumah-murah-siap-huni-di-arcamanik-172054078783/,Dijual Cepat Rumah Murah siap Huni di Arcamanik,Arcamanik,,3,3,150,102,Rp1.375.000.000
https://www.lamudi.co.id/jual/jawa-barat/bandung/di-jual-rumah-siap-huni-rapih-terawat-di-perumahan-172050765949/,Di jual rumah siap huni rapih terawat di perumahan ciskul,Arcamanik,,4,3,150,118,Rp775.000.000
https://www.lamudi.co.id/jual/jawa-barat/bandung/dijual-cepattt-rumah-di-arcamanik-172041295690/,DIJUAL CEPATTT rumah di Arcamanik,Arcamanik,,3,1,120,99,Rp995.000.000
https://www.lamudi.co.id/jual/jawa-barat/bandung/di-jual-rumah-baru-dua-lantai-minimalis-modern-di-172035397434/,Di Jual Rumah Baru Dua Lantai Minimalis Modern Di Cisaranten,Arcamanik,,3,2,75,113,Rp950.000.000
https://www.lamudi.co.id/jual/jawa-barat/bandung/di-jual-rumah-cantik-baru-renovasi-di-cisaranten-a-17203536647/,Di Jual Rumah Cantik Baru Renovasi Di Cisaranten Arcamanik,Arcamanik,,3,2,78,98,Rp794.000.000
https://www.lamudi.co.id/jual/jawa-barat/bandung/dijual-rumah-lux-mewah-full-furnished-arcamanik-ci-172033473653/,Dijual Rumah Lux Mewah Full Furnished Arcamanik Cisaranten Antapani,Arcamanik,,6,5,550,300,Rp5.700.000.000
https://www.lamudi.co.id/jual/jawa-barat/bandung/dijual-rumah-mewah-ada-kolam-renang-antapani-arcam-172033422999/,Dijual Rumah Mewah Ada Kolam Renang Antapani Arcamanik Bandung,Arcamanik,,5,4,300,182,Rp3.500.000.000
https://www.lamudi.co.id/jual/jawa-barat/bandung/rumah-murah-di-arcamanik-172033151854/,rumah murah di arcamanik,Arcamanik,1,3,2,100,176,Rp1.200.000.000
https://www.lamudi.co.id/jual/jawa-barat/bandung/rumah-luas-arcamanik-172031803939/,RUMAH LUAS ARCAMANIK,Arcamanik,4,3,2,350,400,Rp2.850.000.000
https://www.lamudi.co.id/jual/jawa-barat/bandung/dijual-rumah-tinggal-daerah-arcamanik-posisi-disud-172031337655/,DIJUAL Rumah tinggal daerah Arcamanik ( posisi disudut ),Arcamanik,,4,3,180,199,Rp2.650.000.000
https://www.lamudi.co.id/jual/jawa-barat/bandung/rumah-jl-bulutangkis-arcamanik-luas-dijual-murah-v-172029580818/,Rumah Jl. Bulutangkis Arcamanik Luas Dijual Murah Via Lelang,Arcamanik,,7,4,312,305,Rp1.500.000.000
https://www.lamudi.co.id/jual/jawa-barat/bandung/jual-cepat-rumah-murah-arcamanik-endah-172027766899/,Jual Cepat Rumah murah Arcamanik Endah,Arcamanik,2,3,2,100,176,Rp1.200.000.000
https://www.lamudi.co.id/jual/jawa-barat/bandung/rumah-cantik-di-jl-pacuan-kuda-arcamanik-172027700392/,Rumah Cantik di Jl Pacuan Kuda Arcamanik,Arcamanik,,2,1,80,140,Rp1.275.000.000
https://www.lamudi.co.id/jual/jawa-barat/bandung/dijual-rumah-komplek-panorama-alam-parahyangan-ban-17202476526/,DIJUAL RUMAH KOMPLEK PANORAMA ALAM PARAHYANGAN BANDUNG,Arcamanik,,5,5,300,240,Rp3.500.000.000
https://www.lamudi.co.id/jual/jawa-barat/bandung/jual-cepat-rumah-murah-arcamanik-172024744492/,Jual Cepat Rumah murah Arcamanik,Arcamanik,1,3,2,100,176,Rp1.200.000.000
https://www.lamudi.co.id/jual/jawa-barat/bandung/murah-rumah-minimalis-cisaranten-arcamanik-172016839052/,Murah     Rumah Minimalis Cisaranten Arcamanik,Arcamanik,,2,1,50,73,Rp680.000.000
https://www.lamudi.co.id/jual/jawa-barat/bandung/rumah-pinggir-jalan-dijual-di-bandung-dkt-sport-ja-172015012619/,Rumah Pinggir Jalan Dijual di Bandung dkt Sport Jabar Arcamanik,Arcamanik,,3,2,210,153,Rp1.600.000.000
https://www.lamudi.co.id/jual/jawa-barat/bandung/rumah-nyaman-di-aeromodeling-arcamanik-endah-172009865430/,Rumah Nyaman di Aeromodeling Arcamanik Endah,Arcamanik,,4,3,176,176,Rp1.900.000.000
https://www.lamudi.co.id/jual/jawa-barat/bandung/rumah-vintage-lingkugan-asri-terawat-siap-huni-arc-172008562179/,Rumah Vintage Lingkugan Asri Terawat Siap Huni Arcamanik Bandung,Arcamanik,1,5,3,220,231,Rp2.500.000.000
https://www.lamudi.co.id/jual/jawa-barat/bandung/rumah-lingkungan-asri-terawat-siap-huni-di-arcaman-17200826307/,Rumah Lingkungan Asri Terawat Siap Huni di Arcamanik Kota Bandung,Arcamanik,2,3,2,250,230,Rp2.500.000.000
https://www.lamudi.co.id/jual/jawa-barat/bandung/rumah-minimalis-terawat-siap-huni-di-golf-barat-ar-172008235199/,Rumah Minimalis Terawat Siap Huni di Golf Barat Arcamanik Kota Bandung,Arcamanik,2,3,2,200,240,Rp2.800.000.000
https://www.lamudi.co.id/jual/jawa-barat/bandung/rumah-siap-huni-lt150-cisaranten-kulon-arcamanik-7-172007942220/,rumah siap huni lt150 cisaranten kulon arcamanik 795juta,Arcamanik,1,3,3,110,150,Rp799.000.000
https://www.lamudi.co.id/jual/jawa-barat/bandung/jual-butuh-rumah-di-arcamanik-cck-usaha-atau-tingg-172007419856/,Jual Butuh Rumah di Arcamanik cck usaha atau Tinggal,Arcamanik,,3,2,218,153,Rp1.600.000.000
https://www.lamudi.co.id/jual/jawa-barat/bandung/rumah-hook-asri-terawat-siap-huni-di-golf-barat-ar-172006674495/,Rumah Hook Asri Terawat Siap Huni di Golf Barat Arcamanik Bandung,Arcamanik,2,3,2,250,421,Rp3.650.000.000
https://www.lamudi.co.id/jual/jawa-barat/bandung/rumah-luas-hook-terawat-siap-huni-area-golf-barat-17199980589/,"Rumah Luas ,Hook Terawat Siap Huni, Area Golf Barat Arcamanik Bandung",Arcamanik,2,3,2,250,306,Rp2.750.000.000
https://www.lamudi.co.id/jual/jawa-barat/bandung/jual-rumah-cantik-dan-unikk-desain-mewah-di-arcama-171998523794/,Jual Rumah CANTIK dan UNIkK desain MEWAH di  ARCAMANIK kota Bandung,Arcamanik,,2,2,60,85,Rp975.000.000
https://www.lamudi.co.id/jual/jawa-barat/bandung/tinggal-bawa-koper-kawasan-arcamanik-171985095734/,Tinggal bawa Koper Kawasan Arcamanik,Arcamanik,,4,3,112,85,Rp979.990.000
https://www.lamudi.co.id/jual/jawa-barat/bandung/rumah-minimalis-2-lti-komplek-arcamanik-endah-dkt-17198272947/,Rumah minimalis 2 lti komplek arcamanik endah dkt terminal antapani,Arcamanik,25,4,2,110,98,Rp1.450.000.000
