Link,Judul,Kecamatan,Lahan Parkir,Kamar Tidur,Kamar Mandi,Luas Bangunan,Luas Tanah,Harga
https://www.lamudi.co.id/jual/jawa-barat/bandung/rumah-minimalis-strategis-arcamanik-endah-antapani-171574818990/,Rumah Minimalis Strategis Arcamanik Endah Antapani  Kota bandung,Arcamanik,,6,6,400,424,Rp3.000.000.000
https://www.lamudi.co.id/jual/jawa-barat/bandung/rumah-baru-bangunan-2-lantai-dekat-arcamanik-kota-171403334348/,Rumah baru bangunan 2 lantai dekat Arcamanik Kota Bandung strategis,Arcamanik,1,4,2,98,119,Rp1.100.000.000
https://www.lamudi.co.id/jual/jawa-barat/bandung/dijual-rumah-2lantai-siap-huni-lt175-200-hrg1-3m-d-171393764634/,"Dijual rumah 2lantai  siap huni lt175/200 hrg1,3m di Arcamanik bandung",Arcamanik,2,4,4,200,175,Rp1.300.000.000
https://www.lamudi.co.id/jual/jawa-barat/bandung/dijual-rumah-minimalis-siap-huni-lt175-200-hrg1-3m-171393610542/,"dijual rumah minimalis siap huni lt175/200 hrg1,3m  Arcamanik Bandung",Arcamanik,,4,2,200,175,Rp1.300.000.000
https://www.lamudi.co.id/jual/jawa-barat/bandung/dijual-cepat-rumah-cantik-di-perumahan-gading-rege-171392947370/,Dijual Cepat Rumah Cantik di Perumahan Gading Regency Kota Bandung,Arcamanik,,4,3,90,139,Rp1.350.000.000
https://www.lamudi.co.id/jual/jawa-barat/bandung/rumah-baru-siap-huni-di-cisaranten-kulon-arcamanik-171391526021/,Rumah Baru Siap Huni Di Cisaranten Kulon Arcamanik 2 unit,Arcamanik,1,3,3,100,100,Rp1.200.000.000
https://www.lamudi.co.id/jual/jawa-barat/bandung/dijual-cepat-rumah-area-arcamanik-antapani-171638313983/,Dijual Cepat Rumah Area Arcamanik Antapani,Arcamanik,,2,2,90,126,Rp1.200.000.000
https://www.lamudi.co.id/jual/jawa-barat/bandung/rumah-minimalis-2-lantai-di-cisaranten-bandung-171361524462/,Rumah Minimalis 2 Lantai di Cisaranten Bandung,Arcamanik,2,3,3,115,70,Rp1.300.000.000
https://www.lamudi.co.id/jual/jawa-barat/bandung/dijual-rumah-minimalis-siap-huni-dikomplek-arcaman-171361449154/,Dijual rumah minimalis siap huni dikomplek arcamanik,Arcamanik,1,2,1,60,90,Rp699.000.000
https://www.lamudi.co.id/jual/jawa-barat/bandung/dijual-rumah-nyaman-di-cluster-arcamanik-kota-band-171361366482/,Dijual rumah nyaman di cluster arcamanik kota bandung,Arcamanik,1,3,2,90,133,Rp995.000.000
https://www.lamudi.co.id/jual/jawa-barat/bandung/rumah-bisa-buat-usaha-main-road-arcamanik-bandung-171358167737/,Rumah Bisa Buat Usaha Main road Arcamanik Bandung,Arcamanik,,3,2,220,153,Rp1.400.000.000
https://www.lamudi.co.id/jual/jawa-barat/bandung/2lt-termurah-di-jatihandap-bandung-171353452794/,2lt Termurah di Jatihandap Bandung,Arcamanik,,2,2,45,61,Rp479.000.000
https://www.lamudi.co.id/jual/jawa-barat/bandung/dijual-rumah-bagus-arcamanik-endah-dekat-sport-jab-171344498024/,Dijual Rumah Bagus Arcamanik Endah Dekat Sport Jabar Semi Furnish,Arcamanik,2,2,2,115,115,Rp1.350.000.000
https://www.lamudi.co.id/jual/jawa-barat/bandung/hunian-nyaman-terawat-di-perumahan-cisaranten-kulo-171342926095/,Hunian nyaman terawat di Perumahan Cisaranten Kulon Arcamanik Bandung,Arcamanik,1,3,2,100,120,Rp850.000.000
https://www.lamudi.co.id/jual/jawa-barat/bandung/rumah-baru-siap-huni-lt149-100-hrg1m-an-dalam-komp-171334072879/,Rumah baru siap huni lt149/100 hrg1m an  dalam komplek besar Arcamanik,Arcamanik,1,4,2,100,149,Rp1.050.000.000
https://www.lamudi.co.id/jual/jawa-barat/bandung/dijual-rumah-cantik-2-lantai-di-arcamanik-171638320154/,Dijual Rumah Cantik 2 Lantai Di Arcamanik,Arcamanik,,4,4,180,220,Rp2.800.000.000
https://www.lamudi.co.id/jual/jawa-barat/bandung/dijual-rumah-cantik-siap-huni-di-arcamanik-171638324282/,Dijual Rumah Cantik Siap Huni Di Arcamanik,Arcamanik,,3,3,145,208,Rp2.300.000.000
https://www.lamudi.co.id/jual/jawa-barat/bandung/dijual-rumah-area-golf-arcamanik-bandung-171638327949/,Dijual Rumah Area Golf Arcamanik Bandung,Arcamanik,,6,4,200,240,Rp2.800.000.000
https://www.lamudi.co.id/jual/jawa-barat/bandung/desain-eropanya-keren-171285033192/,Desain Eropanya Keren,Arcamanik,,2,3,58,72,Rp747.000.000
https://www.lamudi.co.id/jual/jawa-barat/bandung/rumah-bagus-arcamanik-dekat-sport-jabar-harga-mena-171265729342/,Rumah Bagus Arcamanik Dekat Sport Jabar Harga Menarik,Arcamanik,2,3,3,200,410,Rp2.900.000.000
https://www.lamudi.co.id/jual/jawa-barat/bandung/rumah-baru-2-lantai-scandinavian-siap-huni-arcaman-171227881218/,RUMAH BARU 2 LANTAI SCANDINAVIAN SIAP HUNI ARCAMANIK BANDUNG,Arcamanik,,4,3,110,100,Rp980.000.000
https://www.lamudi.co.id/jual/jawa-barat/bandung/rumah-murah-nyaman-siap-huni-di-komplek-arcamanik-171212638518/,Rumah Murah Nyaman Siap Huni di Komplek Arcamanik Bandung,Arcamanik,,3,1,94,60,Rp600.000.000
https://www.lamudi.co.id/jual/jawa-barat/bandung/rumah-dan-ruko-murah-terawat-arcamanik-171205114394/,Rumah Dan Ruko Murah Terawat Arcamanik,Arcamanik,3,5,5,500,424,Rp3.000.000.000
https://www.lamudi.co.id/jual/jawa-barat/bandung/rumah-murah-di-arcamanik-bandung-siap-huni-17118957319/,Rumah Murah di Arcamanik Bandung Siap huni,Arcamanik,23,3,3,200,410,Rp2.900.000.000
https://www.lamudi.co.id/jual/jawa-barat/bandung/dijual-rumah-baru-2-lantai-di-arcamanik-171176834875/,Dijual Rumah baru 2 lantai di Arcamanik,Arcamanik,,5,4,170,133,Rp1.850.000.000
https://www.lamudi.co.id/jual/jawa-barat/bandung/rumah-minimalis-murah-arcamanik-dekat-antapani-171153497831/,Rumah Minimalis Murah Arcamanik dekat Antapani,Arcamanik,,3,2,140,176,Rp1.125.000.000
https://www.lamudi.co.id/jual/jawa-barat/bandung/rumah-minimalis-modern-arcamanik-dkt-antapani-171153461743/,Rumah Minimalis Modern Arcamanik dkt Antapani,Arcamanik,,4,3,170,130,Rp1.850.000.000
https://www.lamudi.co.id/jual/jawa-barat/bandung/dijual-rumah-baru-2-lantai-belakang-griya-arcamani-171151432016/,"Dijual rumah baru, 2 lantai, belakang Griya Arcamanik Siap Huni Lok Ok",Arcamanik,1,3,3,130,96,Rp1.200.000.000
https://www.lamudi.co.id/jual/jawa-barat/bandung/dijual-rumah-siap-huni-griya-caraka-arcamanik-band-171143247458/,Dijual rumah siap huni Griya Caraka Arcamanik Bandung,Arcamanik,,8,9,569,256,Rp4.300.000.000
https://www.lamudi.co.id/jual/jawa-barat/bandung/unique-house-rumah-berasa-apartment-yang-cozy-bang-171108006985/,Unique House Rumah Berasa Apartment yang Cozy Banget di Arcamanik,Arcamanik,,1,1,90,126,Rp1.200.000.000
https://www.lamudi.co.id/jual/jawa-barat/bandung/ready-cluster-villa-tropis-sindanglaya-bandung-cas-171107546659/,READY CLUSTER VILLA TROPIS SINDANGLAYA BANDUNG CASH ATAU KPR TANPA DP,Arcamanik,1,3,2,60,63,Rp628.000.000
https://www.lamudi.co.id/jual/jawa-barat/bandung/rumah-di-sembrani-dijual-cepat-harga-terjangkau-171107495489/,Rumah di Sembrani Dijual Cepat Harga Terjangkau,Arcamanik,,3,2,180,128,Rp1.150.000.000
https://www.lamudi.co.id/jual/jawa-barat/bandung/jual-rumah-bagus-siap-huni-no-renovasi-di-arcamani-171098509986/,Jual Rumah BAGUS siap huni no renovasi di Arcamanik kota Bandung,Arcamanik,,3,3,115,70,Rp1.300.000.000
https://www.lamudi.co.id/jual/jawa-barat/bandung/rumah-siap-huni-dekat-griya-di-arcamanik-171089862095/,Rumah Siap Huni Dekat Griya Di Arcamanik,Arcamanik,,3,3,205,300,Rp2.800.000.000
https://www.lamudi.co.id/jual/jawa-barat/bandung/rumah-2-lantai-murah-sekitar-arcamanik-jarang-ada-171085875567/,"Rumah 2 Lantai murah sekitar Arcamanik,Jarang ada",Arcamanik,,4,2,120,126,Rp740.000.000
https://www.lamudi.co.id/jual/jawa-barat/bandung/dijual-cepat-rumah-bagus-arcamanik-dekat-sport-jab-171057278332/,Dijual Cepat Rumah Bagus Arcamanik Dekat Sport Jabar Harga Murah,Arcamanik,2,3,3,200,410,Rp2.900.000.000
https://www.lamudi.co.id/jual/jawa-barat/bandung/jual-cepat-rumah-minimalis-komplek-arcamanik-cisar-171031118516/,JUAL CEPAT RUMAH MINIMALIS KOMPLEK ARCAMANIK CISARANTEN,Arcamanik,,2,1,52,87,Rp680.000.000
https://www.lamudi.co.id/jual/jawa-barat/bandung/dijual-rumah-minimalis-di-arcamanik-171031040992/,dijual rumah minimalis di Arcamanik,Arcamanik,,2,1,60,33,Rp475.000.000
https://www.lamudi.co.id/jual/jawa-barat/bandung/rumah-bagus-siap-huni-strategis-di-cisaranten-kulo-171030040524/,Rumah Bagus Siap Huni Strategis Di Cisaranten Kulon Arcamanik Bandung,Arcamanik,1,3,3,100,101,Rp1.150.000.000
https://www.lamudi.co.id/jual/jawa-barat/bandung/rumah-2lt-termurah-di-jatihandap-171025064678/,Rumah 2lt Termurah di Jatihandap,Arcamanik,,2,1,45,61,Rp479.000.000
https://www.lamudi.co.id/jual/jawa-barat/bandung/rumah-cantik-bagus-di-komplek-cisaranten-wetan-arc-171022569748/,Rumah Cantik Bagus Di Komplek Cisaranten Wetan Arcamanik Bandung KPR,Arcamanik,1,3,2,66,99,Rp794.900.000
https://www.lamudi.co.id/jual/jawa-barat/bandung/dijual-cepat-rumah-cantik-cozy-di-perum-gading-reg-171020716958/,"Dijual Cepat Rumah Cantik & Cozy di Perum. Gading Regency, Bandung",Arcamanik,,4,3,90,139,Rp1.350.000.000
https://www.lamudi.co.id/jual/jawa-barat/bandung/rumah-baru-skema-cicil-ke-developer-legalitas-shm-170986986025/,Rumah Baru Skema Cicil Ke Developer Legalitas SHM Cisaranten Bandung,Arcamanik,1,3,2,62,61,Rp745.000.000
https://www.lamudi.co.id/jual/jawa-barat/bandung/rumah-siap-huni-lokasi-strategis-di-cisaranten-kul-170955306048/,Rumah Siap Huni Lokasi Strategis Di Cisaranten Kulon Kota Bandung SHM,Arcamanik,1,3,3,100,100,Rp1.150.000.000
https://www.lamudi.co.id/jual/jawa-barat/bandung/di-jual-rumah-cocok-untuk-tempat-usaha-di-arcamani-170953385121/,Di jual rumah cocok untuk tempat usaha di Arcamanik,Arcamanik,,4,4,500,710,Rp5.500.000.000
https://www.lamudi.co.id/jual/jawa-barat/bandung/sisa-1-rumah-baru-cisaranten-kulon-modern-minimali-171447892314/,Sisa 1 Rumah Baru Cisaranten Kulon Modern Minimalis Buruan,Arcamanik,2,3,3,98,100,Rp1.150.000.000
https://www.lamudi.co.id/jual/jawa-barat/bandung/rumah-siap-huni-minimalis-bangunan-baru-lokasi-arc-170935845371/,Rumah Siap Huni Minimalis Bangunan Baru Lokasi Arcamanik Kodya Bandung,Arcamanik,1,3,2,70,115,Rp1.500.000.000
https://www.lamudi.co.id/jual/jawa-barat/bandung/dijual-murah-rumah-lt180-120-hrg1-1-d-cluster-arca-170918814968/,"Dijual murah rumah lt180/120 hrg1,1 d cluster Arcamanik Bandung",Arcamanik,,2,2,120,180,Rp1.100.000.000
https://www.lamudi.co.id/jual/jawa-barat/bandung/di-jual-rumah-di-bawah-harga-pasar-di-perumahan-ar-17090923867/,Di jual rumah di bawah harga pasar di perumahan Arcamanik,Arcamanik,,5,3,200,360,Rp2.200.000.000
https://www.lamudi.co.id/jual/jawa-barat/bandung/dijual-rumah-lokasi-strategis-cisaranten-kulon-arc-170902193930/,"Dijual rumah Lokasi Strategis Cisaranten Kulon, Arcamanik, Bandung",Arcamanik,,3,2,167,315,Rp2.500.000.000
https://www.lamudi.co.id/jual/jawa-barat/bandung/dijual-murah-rumah-di-cisaranteun-kulon-171357632680/,dijual murah rumah di cisaranteun kulon,Arcamanik,,4,2,200,120,Rp990.000.000
https://www.lamudi.co.id/jual/jawa-barat/bandung/dijual-rumah-strategis-area-cisaranteun-regency-170848237418/,Dijual Rumah Strategis Area Cisaranteun Regency,Arcamanik,2,3,3,115,146,Rp1.350.000.000
https://www.lamudi.co.id/jual/jawa-barat/bandung/jual-rumah-baru-lingkungan-nyaman-di-arcamanik-kot-170842505771/,Jual Rumah Baru lingkungan Nyaman di  Arcamanik kota Bandung,Arcamanik,,3,2,85,60,Rp900.000.000
https://www.lamudi.co.id/jual/jawa-barat/bandung/rumah-murah-siap-huni-area-arcamanik-jarang-ada-170840237687/,"Rumah murah siap huni area Arcamanik,jarang ada",Arcamanik,,5,4,150,176,Rp1.300.000.000
https://www.lamudi.co.id/jual/jawa-barat/bandung/dijual-rumah-baru-panyileukan-dekat-polda-2-lantai-17082190313/,DIJUAL RUMAH BARU PANYILEUKAN DEKAT POLDA 2 LANTAI,Arcamanik,1,3,2,96,91,Rp860.000.000
https://www.lamudi.co.id/jual/jawa-barat/bandung/dijual-rumah-di-kompleks-antabaru-cisaranten-kulon-170814566017/,Dijual Rumah di Kompleks Antabaru Cisaranten Kulon Bandung Timur,Arcamanik,,3,2,148,205,Rp1.600.000.000
https://www.lamudi.co.id/jual/jawa-barat/bandung/dijual-rumah-baru-minimalis-lokasi-kota-bandung-ar-170783083733/,"Dijual rumah baru, minimalis lokasi kota Bandung Arcamanik Cisaranten",Arcamanik,1,3,2,70,95,Rp850.000.000
https://www.lamudi.co.id/jual/jawa-barat/bandung/dijual-cepat-rumah-2-lantai-di-cisaranten-kulon-ar-170815480137/,Dijual cepat rumah 2 lantai di Cisaranten Kulon Arcamanik Kota Bandung,Arcamanik,1,3,2,100,120,Rp795.000.000
https://www.lamudi.co.id/jual/jawa-barat/bandung/rumah-baru-sisa-1-unit-di-cisaranten-arcamanik-170677330796/,"Rumah baru sisa 1 Unit di Cisaranten , Arcamanik",Arcamanik,2,4,4,155,120,Rp1.350.000.000
https://www.lamudi.co.id/jual/jawa-barat/bandung/rumah-baru-asri-arcamanik-bandung-murah-minimalis-170675151728/,Rumah Baru Asri Arcamanik Bandung Murah Minimalis Berkualitas,Arcamanik,1,3,2,75,103,Rp945.000.000
https://www.lamudi.co.id/jual/jawa-barat/bandung/rumah-bagus-terawat-bisa-buat-home-industri-gor-ar-171749793542/,Rumah Bagus Terawat Bisa buat Home Industri Gor Arcamanik Bandung SHM,Arcamanik,1,4,2,122,110,Rp1.290.000.000
https://www.lamudi.co.id/jual/jawa-barat/bandung/dijual-rumah-baru-di-arcamanik-bandung-kota-170659671987/,Dijual Rumah Baru di Arcamanik Bandung Kota,Arcamanik,2,4,3,135,96,Rp1.185.000.000
https://www.lamudi.co.id/jual/jawa-barat/bandung/jual-cepat-rumah-baru-minimalis-komp-damri-cisaran-170658568473/,JUAL CEPAT RUMAH BARU MINIMALIS KOMP DAMRI CISARANTEN WETAN ARCAMANIK,Arcamanik,,3,2,65,98,Rp795.000.000
https://www.lamudi.co.id/jual/jawa-barat/bandung/jual-rumah-baru-siap-huni-posisi-hook-di-arcamanik-170650922865/,Jual RUMAH Baru siap Huni posisi Hook di Arcamanik kota Bandung,Arcamanik,,4,3,120,110,Rp1.400.000.000
https://www.lamudi.co.id/jual/jawa-barat/bandung/dijual-rumah-bagus-belakang-griya-arcamanik-170630609675/,dijual rumah bagus belakang griya Arcamanik,Arcamanik,,3,2,178,90,Rp950.000.000
https://www.lamudi.co.id/jual/jawa-barat/bandung/jual-mendesak-rumah-luas-kolam-renang-di-arcamanik-170626368473/,jual mendesak Rumah Luas Kolam Renang di Arcamanik Antapani Bandung,Arcamanik,,3,2,145,208,Rp2.600.000.000
https://www.lamudi.co.id/jual/jawa-barat/bandung/dijual-2-unit-rumah-baru-minimalis-cisaranten-kulo-170625023688/,Dijual 2 Unit Rumah Baru Minimalis Cisaranten Kulon Arcamanik,Arcamanik,1,3,2,70,95,Rp875.000.000
https://www.lamudi.co.id/jual/jawa-barat/bandung/rumah-arcamanik-ready-stock-170623744532/,rumah arcamanik ready stock,Arcamanik,,2,2,55,50,Rp585.000.000
https://www.lamudi.co.id/jual/jawa-barat/bandung/rumah-murah-arcamanik-main-road-dkt-griya-sport-ja-170604442040/,"Rumah Murah Arcamanik  main road dkt Griya,sport jabar,luas  2 Lt",Arcamanik,,6,6,400,424,Rp3.150.000.000
https://www.lamudi.co.id/jual/jawa-barat/bandung/rumah-cantik-2-lantai-di-komplek-arcamanik-bandung-170601588861/,Rumah Cantik 2 lantai di Komplek Arcamanik Bandung Kota,Arcamanik,,3,3,136,98,Rp1.500.000.000
https://www.lamudi.co.id/jual/jawa-barat/bandung/rumah-baru-ready-bisa-kpr-komplek-cisaranten-arcam-170582122549/,rumah baru ready bisa kpr komplek cisaranten arcamanik,Arcamanik,,3,2,70,95,Rp850.000.000
https://www.lamudi.co.id/jual/jawa-barat/bandung/perumahan-syariah-tanpa-bank-di-permata-cisaranten-171733642435/,Perumahan Syariah Tanpa Bank Di Permata Cisaranten Arcamanik Bandung,Arcamanik,1,3,1,45,67,Rp595.000.000
https://www.lamudi.co.id/jual/jawa-barat/bandung/rumah-baru-2-lantai-di-cisaranten-arcamanik-bandun-170563281331/,RUMAH BARU 2 LANTAI DI CISARANTEN ARCAMANIK BANDUNG SIAP HUNI,Arcamanik,1,3,4,135,96,Rp1.200.000.000
https://www.lamudi.co.id/jual/jawa-barat/bandung/rumah-2lt-cipadung-kota-bandung-170559680969/,Rumah 2lt Cipadung Kota Bandung,Arcamanik,,2,2,50,85,Rp694.000.000
https://www.lamudi.co.id/jual/jawa-barat/bandung/rumah-di-kota-bandung-2-lantai-dekat-upi-cibiru-21-170550354192/,RUMAH DI KOTA BANDUNG 2 LANTAI DEKAT UPI CIBIRU 21,Arcamanik,1,2,2,50,60,Rp515.000.000
https://www.lamudi.co.id/jual/jawa-barat/bandung/rumah-di-kota-bandung-2-lantai-dekat-upi-cibiru-17-170541282862/,RUMAH DI KOTA BANDUNG 2 LANTAI DEKAT UPI CIBIRU 17,Arcamanik,1,2,2,59,60,Rp512.000.000
https://www.lamudi.co.id/jual/jawa-barat/bandung/rumah-baru-gaya-modern-lokasi-strategis-arcamanik-170540818887/,Rumah Baru Gaya Modern Lokasi Strategis Arcamanik Endah,Arcamanik,2,5,4,170,133,Rp1.850.000.000
https://www.lamudi.co.id/jual/jawa-barat/bandung/rumah-bagus-siap-huni-strategis-di-cisaranten-kulo-171370414220/,Rumah Bagus Siap Huni Strategis Di Cisaranten Kulon Arcamanik Bandung,Arcamanik,1,3,2,102,102,Rp1.150.000.000
https://www.lamudi.co.id/jual/jawa-barat/bandung/rumah-baru-2-lantai-di-arcamanik-cisaranten-bandun-170539366372/,RUMAH BARU 2 LANTAI DI ARCAMANIK CISARANTEN BANDUNG SIAP HUNI,Arcamanik,2,4,4,160,120,Rp1.275.000.000
https://www.lamudi.co.id/jual/jawa-barat/bandung/rumah-baru-scandinavian-1-lantai-di-cisaranten-kul-170539297220/,Rumah Baru Scandinavian 1 Lantai Di Cisaranten Kulon Arcamanik Bandung,Arcamanik,1,3,2,70,95,Rp850.000.000
https://www.lamudi.co.id/jual/jawa-barat/bandung/rumah-di-kota-bandung-2-lantai-dekat-upi-cibiru-05-170537693321/,RUMAH DI KOTA BANDUNG 2 LANTAI DEKAT UPI CIBIRU 05,Arcamanik,1,2,2,50,60,Rp512.000.000
https://www.lamudi.co.id/jual/jawa-barat/bandung/rumah-mewah-dan-cantik-banget-di-arcamanik-bandung-170515675455/,Rumah Mewah dan Cantik Banget di Arcamanik Bandung dijual,Arcamanik,,3,2,155,150,Rp2.200.000.000
https://www.lamudi.co.id/jual/jawa-barat/bandung/rumah-cantik-cluster-cisaranten-residence-arcamani-170506734856/,Rumah Cantik Cluster Cisaranten Residence Arcamanik Strategis SiapHuni,Arcamanik,,2,1,70,120,Rp950.000.000
https://www.lamudi.co.id/jual/jawa-barat/bandung/rumah-luas-di-komplek-cisaranten-kulon-arcamanik-d-170506718879/,Rumah Luas di Komplek Cisaranten Kulon Arcamanik dekat Masjid Strategs,Arcamanik,,5,4,245,186,Rp1.600.000.000
https://www.lamudi.co.id/jual/jawa-barat/bandung/dijual-rumah-daerah-arcamanik-bandung-170503467925/,Dijual Rumah daerah Arcamanik Bandung,Arcamanik,,3,1,145,177,Rp1.200.000.000
https://www.lamudi.co.id/jual/jawa-barat/bandung/jual-cepat-murah-rumah-minimalis-di-arcamanik-band-170498113727/,Jual Cepat Murah Rumah Minimalis di Arcamanik Bandung,Arcamanik,1,2,1,125,90,Rp900.000.000
https://www.lamudi.co.id/jual/jawa-barat/bandung/rumah-baru-bagus-lokasi-strategis-di-cisaranten-ar-170487772661/,Rumah Baru Bagus Lokasi Strategis Di Cisaranten Arcamanik,Arcamanik,,3,3,105,100,Rp1.150.000.000
https://www.lamudi.co.id/jual/jawa-barat/bandung/dijual-rumah-baru-tanah-luas-harga-puas-cisaranten-170478736317/,Dijual Rumah Baru Tanah Luas Harga Puas Cisaranten Arcamanik,Arcamanik,1,3,2,70,148,Rp900.000.000
https://www.lamudi.co.id/jual/jawa-barat/bandung/dijual-rumah-bagus-siap-huni-di-komplek-cisaranten-170478625042/,Dijual Rumah Bagus Siap Huni di Komplek Cisaranten Arcamanik,Arcamanik,1,5,3,175,105,Rp1.270.000.000
https://www.lamudi.co.id/jual/jawa-barat/bandung/dijual-rumah-caraka-resident-arcamanik-dalam-clust-170477291417/,Dijual Rumah Caraka Resident Arcamanik dalam Cluster Posisi Hoek,Arcamanik,1,3,2,105,137,Rp1.400.000.000
https://www.lamudi.co.id/jual/jawa-barat/bandung/dijual-rumah-murah-di-cisaranten-kulon-arcamanik-h-170471487476/,Dijual Rumah Murah Di Cisaranten Kulon Arcamanik Hitung Tanah,Arcamanik,,2,1,165,287,Rp1.250.000.000
https://www.lamudi.co.id/jual/jawa-barat/bandung/rumah-murah-2-lantai-kota-bandung-timur-cluster-ma-170463641959/,rumah murah 2 lantai kota bandung timur cluster mahaka land jatihandap,Arcamanik,17,2,2,45,61,Rp479.000.000
https://www.lamudi.co.id/jual/jawa-barat/bandung/rumah-baru-cingised-cisaranten-kulon-dekat-antapan-171956786718/,Rumah Baru Cingised Cisaranten Kulon Dekat Antapani City Bandung KPRS,Arcamanik,1,2,2,98,50,Rp791.000.000
https://www.lamudi.co.id/jual/jawa-barat/bandung/rumah-murah-hook-ada-kolam-renang-di-arcamanik-end-170447107250/,Rumah Murah Hook Ada Kolam Renang di Arcamanik Endah Bandung,Arcamanik,,3,2,180,198,Rp2.500.000.000
https://www.lamudi.co.id/jual/jawa-barat/bandung/rumah-murah-permata-elok-arcamanik-dekat-griya-arc-17044689876/,Rumah MURAH Permata Elok Arcamanik dekat Griya Arcamanik,Arcamanik,,2,1,85,94,Rp675.000.000
https://www.lamudi.co.id/jual/jawa-barat/bandung/rumah-di-mainroad-cisaranten-arcamanik-sekitar-per-170446748055/,Rumah di Mainroad Cisaranten Arcamanik Sekitar Permata Elok Strategis,Arcamanik,,3,2,120,90,Rp825.000.000
https://www.lamudi.co.id/jual/jawa-barat/bandung/rumah-minimalis-di-cisaranten-permata-indah-arcama-170446725472/,Rumah Minimalis di Cisaranten Permata Indah Arcamanik Bandung,Arcamanik,,2,1,50,80,Rp625.000.000
https://www.lamudi.co.id/jual/jawa-barat/bandung/dijual-rumah-2-tingkat-siap-huni-di-perumahan-arca-170435696479/,Dijual rumah 2 tingkat siap huni di perumahan arcamanik,Arcamanik,,4,2,100,66,Rp875.000.000
https://www.lamudi.co.id/jual/jawa-barat/bandung/rumah-baru-di-cluster-arcamanik-dekat-lapas-sukami-170428944594/,Rumah BARU di Cluster Arcamanik dekat Lapas Sukamiskin Sport Jabar,Arcamanik,,3,2,111,111,Rp1.400.000.000
https://www.lamudi.co.id/jual/jawa-barat/bandung/rumah-cantik-di-cluster-puri-cisaranten-arcamanik-17042890095/,Rumah Cantik di Cluster Puri Cisaranten Arcamanik Hunian Eklusive,Arcamanik,,4,3,200,119,Rp1.785.000.000
https://www.lamudi.co.id/jual/jawa-barat/bandung/rumah-strategis-di-cluster-puri-cisaranten-arcaman-170428852757/,Rumah Strategis di Cluster Puri Cisaranten Arcamanik Siap Huni,Arcamanik,,3,3,80,120,Rp1.200.000.000
https://www.lamudi.co.id/jual/jawa-barat/bandung/rumah-mewah-di-komplek-golf-arcamanik-endah-jalan-170428834055/,Rumah Mewah di Komplek Golf Arcamanik Endah Jalan Lebar Strategis,Arcamanik,,4,5,500,350,Rp5.700.000.000
https://www.lamudi.co.id/jual/jawa-barat/bandung/rumah-strategis-di-mainroad-jalan-utama-arcamanik-17042879663/,Rumah Strategis di Mainroad Jalan Utama Arcamanik Endah Potensial,Arcamanik,,4,4,200,200,Rp4.500.000.000
https://www.lamudi.co.id/jual/jawa-barat/bandung/rumah-murah-siap-huni-di-cisaranten-kulon-arcamani-170386461061/,Rumah Murah Siap Huni di Cisaranten Kulon Arcamanik Bandung,Arcamanik,,2,1,40,70,Rp685.000.000
https://www.lamudi.co.id/jual/jawa-barat/bandung/rumah-murah-di-komplek-griya-caraka-arcamanik-enda-170377205051/,Rumah MURAH di Komplek Griya Caraka Arcamanik Endah dkt Antapani,Arcamanik,,3,1,112,60,Rp599.000.000
https://www.lamudi.co.id/jual/jawa-barat/bandung/dijual-rumah-1-lantai-di-perumahan-cisaranten-kulo-170373278770/,Dijual rumah 1 lantai di Perumahan Cisaranten Kulon Arcamanik Bandung,Arcamanik,1,2,1,60,144,Rp1.100.000.000
https://www.lamudi.co.id/jual/jawa-barat/bandung/dijual-rumah-cluster-ujung-berung-arcamanik-lingku-170333419533/,Dijual rumah cluster ujung Berung Arcamanik lingkungan asri,Arcamanik,,2,2,75,103,Rp1.025.000.000
https://www.lamudi.co.id/jual/jawa-barat/bandung/rumah-2-lantai-jual-cepat-di-arcamanik-bandung-170325859313/,Rumah 2 lantai Jual Cepat di Arcamanik Bandung,Arcamanik,,4,4,250,355,Rp2.800.000.000
https://www.lamudi.co.id/jual/jawa-barat/bandung/rumah-asri-nyaman-furnish-di-arcamanik-bandung-170317309074/,Rumah Asri Nyaman Furnish di Arcamanik Bandung,Arcamanik,,3,2,140,350,Rp2.500.000.000
https://www.lamudi.co.id/jual/jawa-barat/bandung/rumah-cantik-harga-menarik-di-arcamanik-dekat-anta-170262918163/,"Rumah Cantik Harga Menarik di Arcamanik Dekat Antapani, Bandung Kota",Arcamanik,1,3,2,180,198,Rp2.600.000.000
https://www.lamudi.co.id/jual/jawa-barat/bandung/rumah-2-lantai-di-arcamanik-siap-huni-dekat-mesjid-170245400596/,Rumah 2 Lantai di Arcamanik siap huni dekat mesjid,Arcamanik,2,3,2,120,114,Rp1.450.000.000
https://www.lamudi.co.id/jual/jawa-barat/bandung/rumah-mewah-di-arcamanik-170210105537/,Rumah mewah di arcamanik,Arcamanik,10,3,2,180,195,Rp2.500.000.000
https://www.lamudi.co.id/jual/jawa-barat/bandung/rumah-siap-huni-griya-caraka-170208887278/,rumah siap huni griya caraka,Arcamanik,,6,3,150,150,Rp1.300.000.000
https://www.lamudi.co.id/jual/jawa-barat/bandung/jual-rumah-cantik-dan-nyaman-di-one-gate-cluster-a-170201337054/,"Jual Rumah Cantik Dan Nyaman Di One Gate Cluster, Arcamanik, Bandung",Arcamanik,1,3,2,80,84,Rp770.000.000
https://www.lamudi.co.id/jual/jawa-barat/bandung/rumah-mewah-furnished-di-arcamanik-kota-bandung-170190597082/,Rumah Mewah Furnished Di Arcamanik Kota Bandung,Arcamanik,2,5,4,480,330,Rp5.700.000.000
https://www.lamudi.co.id/jual/jawa-barat/bandung/rumah-mainroad-di-cisaranten-kulon-arcamanik-kota-171733733015/,Rumah Mainroad Di Cisaranten Kulon Arcamanik Kota Bandung Dekat Masjid,Arcamanik,1,2,2,60,53,Rp650.000.000
https://www.lamudi.co.id/jual/jawa-barat/bandung/perumahan-baru-murah-mainroad-di-padasuka-atas-dek-171732291217/,Perumahan Baru Murah Mainroad Di Padasuka Atas Dekat Cikutra Bandung,Arcamanik,1,2,2,61,96,Rp825.000.000
https://www.lamudi.co.id/jual/jawa-barat/bandung/rumah-baru-2-lantai-di-daerah-arcamanik-17016722846/,Rumah Baru 2 Lantai di Daerah Arcamanik,Arcamanik,2,3,2,75,103,Rp945.000.000
https://www.lamudi.co.id/jual/jawa-barat/bandung/rumah-mewah-murah-di-tanjung-asri-residence-antapa-170166550851/,Rumah Mewah Murah Di Tanjung Asri Residence Antapani Arcamanik Bandung,Arcamanik,6,5,2,400,298,Rp6.900.000.000
https://www.lamudi.co.id/jual/jawa-barat/bandung/dijual-rumah-minimalis-siap-huni-di-arcamanik-170160304316/,Dijual Rumah Minimalis Siap Huni Di Arcamanik,Arcamanik,,2,1,50,72,Rp800.000.000
https://www.lamudi.co.id/jual/jawa-barat/bandung/rumah-baru-1-lantai-di-kav-geology-cisaranten-kulo-170150155359/,Rumah Baru 1 lantai di kav Geology Cisaranten Kulon Arcamanik,Arcamanik,1,2,1,60,70,Rp660.000.000
https://www.lamudi.co.id/jual/jawa-barat/bandung/rumah-baru-on-progress-2-lt-di-kav-geology-cisaran-170148545467/,Rumah Baru on Progress 2 lt di kav Geology Cisaranten Kulon Arcamanik,Arcamanik,1,3,2,75,103,Rp945.000.000
https://www.lamudi.co.id/jual/jawa-barat/bandung/rumah-baru-semi-furnished-170112068214/,RUMAH BARU SEMI FURNISHED,Arcamanik,,4,3,125,119,Rp2.250.000.000
https://www.lamudi.co.id/jual/jawa-barat/bandung/jual-rumah-hook-siap-huni-di-arcamanik-kota-bandun-170012052034/,Jual Rumah Hook siap Huni di Arcamanik kota Bandung,Arcamanik,,4,3,120,110,Rp1.400.000.000
https://www.lamudi.co.id/jual/jawa-barat/bandung/dijual-rumah-murah-posisi-depan-komplek-arcamanik-170011113069/,"Dijual rumah murah, posisi depan, komplek Arcamanik Endah Strategis",Arcamanik,4,5,5,500,424,Rp2.999.000.000
