Link,Judul,Kecamatan,Lahan Parkir,Kamar Tidur,Kamar Mandi,Luas Bangunan,Luas Tanah,Harga
https://www.lamudi.co.id/jual/jawa-barat/bandung/di-jual-rumah-bagus-siap-huni-terawat-the-best-nya-171981061444/,Di jual rumah bagus siap huni terawat the best nya lokasi di arcamanik,Arcamanik,,7,6,500,424,Rp3.100.000.000
https://www.lamudi.co.id/jual/jawa-barat/bandung/di-jual-rumah-siap-huni-the-best-nya-lokasi-di-arc-171980986129/,Di jual rumah siap huni the best nya lokasi di Arcamanik,Arcamanik,,4,3,220,421,Rp3.650.000.000
https://www.lamudi.co.id/jual/jawa-barat/bandung/termurah-rumah-minimalis-arcamanik-endah-bandung-171980911336/,termurah  rumah minimalis arcamanik endah bandung,Arcamanik,,4,3,140,176,Rp1.900.000.000
https://www.lamudi.co.id/jual/jawa-barat/bandung/dijual-rumah-scandinavian-house-sayap-arcamanik-sh-171956825929/,dijual Rumah Scandinavian House Sayap Arcamanik  SHM 630 Jt /Nego,Arcamanik,,2,1,54,72,Rp630.000.000
https://www.lamudi.co.id/jual/jawa-barat/bandung/dijual-rumah-baru-minimalis-di-cisaranten-arcamani-17195627866/,Dijual Rumah baru minimalis di Cisaranten Arcamanik,Arcamanik,,2,1,50,78,Rp670.000.000
https://www.lamudi.co.id/jual/jawa-barat/bandung/dijual-rumah-baru-minimalis-di-cisaranten-arcamani-171956007728/,Dijual Rumah baru minimalis di Cisaranten Arcamanik,Arcamanik,,3,3,100,100,Rp1.200.000.000
https://www.lamudi.co.id/jual/jawa-barat/bandung/rumah-minimalis-di-cisaranten-kulon-arcamanik-band-171948088183/,Rumah minimalis di cisaranten kulon arcamanik bandung,Arcamanik,,3,2,126,150,Rp10.000.000.000
https://www.lamudi.co.id/jual/jawa-barat/bandung/ready-stock-rumah-kota-bandung-171941790612/,Ready Stock Rumah Kota Bandung,Arcamanik,,4,2,86,92,Rp981.000.000
https://www.lamudi.co.id/jual/jawa-barat/bandung/rumah-2-lantai-scandinavian-cisaranten-arcamanik-k-171939633423/,Rumah 2 lantai scandinavian cisaranten arcamanik kota bandung,Arcamanik,20,4,4,155,119,Rp1.300.000.000
https://www.lamudi.co.id/jual/jawa-barat/bandung/rumah-siap-huni-lt99-120-harga995jt-di-komplek-arc-171937804468/,rumah siap huni lt99/120 harga995jt di komplek Arcamanik endah bandung,Arcamanik,1,3,1,122,99,Rp995.000.000
https://www.lamudi.co.id/jual/jawa-barat/bandung/dijual-rumah-dikomplek-pasir-impun-arcamanik-171937730053/,dijual rumah dikomplek pasir impun arcamanik,Arcamanik,1,3,2,90,90,Rp450.000.000
https://www.lamudi.co.id/jual/jawa-barat/bandung/dijual-rumah-murah-bu-dikomplek-arcamanik-kota-ban-171937640891/,DIJUAL RUMAH MURAH BU DIKOMPLEK ARCAMANIK KOTA BANDUNG,Arcamanik,1,3,1,120,99,Rp995.000.000
https://www.lamudi.co.id/jual/jawa-barat/bandung/dijual-rumah-baru-bagus-model-scandinavian-cisaran-171936922830/,Dijual rumah baru bagus model Scandinavian Cisaranten Kulon Arcamanik,Arcamanik,2,4,4,155,119,Rp1.300.000.000
https://www.lamudi.co.id/jual/jawa-barat/bandung/rumah-murah-komplek-pinus-regency-171929929866/,Rumah Murah Komplek Pinus Regency,Arcamanik,2,5,3,187,215,Rp1.450.000.000
https://www.lamudi.co.id/jual/jawa-barat/bandung/rumah-2-lantai-lt90-90-hrg550-di-pasir-impunarcama-171929888085/,rumah 2 lantai lt90/90 hrg550 di pasir impunarcamanik bandung kota,Arcamanik,1,3,2,90,90,Rp550.000.000
https://www.lamudi.co.id/jual/jawa-barat/bandung/rumah-baru-lt140-60-hrg630jt-di-pasir-impun-arcama-171928864584/,Rumah Baru lt140/60 hrg630jt di pasir impun arcamanik bandung kota,Arcamanik,2,2,1,60,140,Rp630.000.000
https://www.lamudi.co.id/jual/jawa-barat/bandung/rumah-bagus-harga-murah-di-arcamanik-kodya-bandung-171922500532/,Rumah Bagus Harga Murah di Arcamanik Kodya Bandung,Arcamanik,,4,2,100,149,Rp975.000.000
https://www.lamudi.co.id/jual/jawa-barat/bandung/rumah-minimalis-terawat-di-cisaranten-kulon-arcama-172137917988/,Rumah Minimalis Terawat Di Cisaranten Kulon Arcamanik Bandung SHM,Arcamanik,1,2,1,45,108,Rp785.000.000
https://www.lamudi.co.id/jual/jawa-barat/bandung/ready-stock-cisaranten-bandung-171915829316/,Ready Stock Cisaranten Bandung,Arcamanik,,4,2,92,85,Rp980.000.000
https://www.lamudi.co.id/jual/jawa-barat/bandung/cluster-kamayangan-arcamanik-171912180863/,Cluster Kamayangan Arcamanik,Arcamanik,1,2,1,50,72,Rp725.000.000
https://www.lamudi.co.id/jual/jawa-barat/bandung/rumah-1lt-jatihandap-kota-bandung-171906327073/,Rumah 1lt Jatihandap Kota Bandung,Arcamanik,,2,1,36,68,Rp531.000.000
https://www.lamudi.co.id/jual/jawa-barat/bandung/rumah-dijual-cepat-minimalis-di-komplek-puridago-a-171905116953/,Rumah dijual cepat minimalis di Komplek Puridago Antapani Kota Bandung,Arcamanik,1,3,2,90,108,Rp1.250.000.000
https://www.lamudi.co.id/jual/jawa-barat/bandung/new-modern-minimalis-arcamanik-endah-dkt-antapani-171894981388/,New Modern Minimalis Arcamanik Endah dkt Antapani,Arcamanik,,4,3,135,96,Rp1.150.000.000
https://www.lamudi.co.id/jual/jawa-barat/bandung/rumah-baru-on-progres-diarcamanik-harga-promo-171893969335/,Rumah baru on progres diarcamanik harga promo,Arcamanik,1,2,1,40,60,Rp580.000.000
https://www.lamudi.co.id/jual/jawa-barat/bandung/dijual-rumah-baru-cisaranten-kulon-arcamanik-siap-17188102235/,Dijual rumah baru Cisaranten kulon Arcamanik siap huni,Arcamanik,,2,1,50,78,Rp670.000.000
https://www.lamudi.co.id/jual/jawa-barat/bandung/ready-stock-di-prrmata-tamansari-asri-arcamanik-ba-17187411450/,Ready Stock di Prrmata Tamansari Asri Arcamanik Bandung,Arcamanik,,2,1,50,78,Rp670.000.000
https://www.lamudi.co.id/jual/jawa-barat/bandung/rumah-baru-kawasan-arcamanik-17186317765/,Rumah Baru Kawasan Arcamanik,Arcamanik,,2,1,44,67,Rp589.990.000
https://www.lamudi.co.id/jual/jawa-barat/bandung/rumah-2lt-dekat-dago-171837215374/,Rumah 2lt Dekat Dago,Arcamanik,,3,2,49,76,Rp499.999.593
https://www.lamudi.co.id/jual/jawa-barat/bandung/rumah-gress-2-lantai-cluster-villa-tropis-sindangl-171832017428/,RUMAH GRESS 2 LANTAI CLUSTER VILLA TROPIS SINDANGLAYA ARCAMANIK (RQ),Arcamanik,1,3,2,60,71,Rp654.000.000
https://www.lamudi.co.id/jual/jawa-barat/bandung/rumah-dijual-cepat-strategis-di-perumahan-antapani-171825354994/,Rumah dijual cepat strategis di Perumahan Antapani Bandung Timur,Arcamanik,1,2,1,80,108,Rp1.250.000.000
https://www.lamudi.co.id/jual/jawa-barat/bandung/jual-rumah-cluster-di-permata-permai-raya-arcamani-171823821646/,Jual rumah cluster di Permata Permai raya arcamanik cisaranten bandung,Arcamanik,,3,2,80,104,Rp680.000.000
https://www.lamudi.co.id/jual/jawa-barat/bandung/dijual-rumah-bisa-custom-3-kamar-di-cisaranten-arc-171815007462/,Dijual rumah bisa custom 3 kamar di Cisaranten Arcamanik kota bandung,Arcamanik,,3,2,65,98,Rp785.000.000
https://www.lamudi.co.id/jual/jawa-barat/bandung/dijual-rumah-siap-huni-tanah-lebar-bisa-kpr-di-arc-171814934669/,Dijual rumah siap huni tanah lebar bisa kpr di Arcamanik kota bandung,Arcamanik,1,2,1,50,78,Rp670.000.000
https://www.lamudi.co.id/jual/jawa-barat/bandung/rumah-murah-di-arcamanik-171814108117/,rumah murah di arcamanik,Arcamanik,,3,1,100,300,Rp1.200.000.000
https://www.lamudi.co.id/jual/jawa-barat/bandung/rumah-murah-cisaranten-171811390458/,Rumah Murah Cisaranten,Arcamanik,,2,1,45,67,Rp590.000.000
https://www.lamudi.co.id/jual/jawa-barat/bandung/rumah-murah-cisaranten-hrg-550-jt-dkt-poltekes-al-17204431165/,Rumah murah cisaranten hrg 550 jt dkt poltekes al islam al ghifari,Arcamanik,30,2,1,45,100,Rp550.000.000
https://www.lamudi.co.id/jual/jawa-barat/bandung/rumah-siap-huni-bagus-3-kamar-di-cisaranten-kulon-17179959213/,Rumah Siap Huni Bagus 3 Kamar Di Cisaranten Kulon Arcamanik Bandung,Arcamanik,1,3,2,155,100,Rp1.200.000.000
https://www.lamudi.co.id/jual/jawa-barat/bandung/jual-rmh-turun-harga-di-arcamanik-171782537321/,jual rmh turun harga  di arcamanik,Arcamanik,,6,6,250,424,Rp3.000.000.000
https://www.lamudi.co.id/jual/jawa-barat/bandung/rmh-bagus-langsung-akses-by-pass-dkt-alghifary-171775347159/,rmh bagus langsung akses by pass dkt Alghifary,Arcamanik,,5,4,250,210,Rp2.500.000.000
https://www.lamudi.co.id/jual/jawa-barat/bandung/dijual-rumah-baru-minimalis-2-lantai-cisaranten-ku-171773046018/,DIJUAL RUMAH BARU MINIMALIS 2 LANTAI CISARANTEN KULON,Arcamanik,,3,3,100,100,Rp1.200.000.000
https://www.lamudi.co.id/jual/jawa-barat/bandung/rumah-luas-di-cisaranten-wetan-kodya-bandung-171769808830/,Rumah Luas di Cisaranten Wetan Kodya Bandung,Arcamanik,,4,2,200,225,Rp910.000.000
https://www.lamudi.co.id/jual/jawa-barat/bandung/rumah-strategis-permata-elok-arcamanik-lokasi-stra-171768289346/,Rumah Strategis Permata Elok Arcamanik Lokasi Strategis Harga Nego,Arcamanik,,2,1,50,92,Rp800.000.000
https://www.lamudi.co.id/jual/jawa-barat/bandung/rumah-mewah-di-arcamanik-endah-dkt-griya-arcamanik-171768219435/,Rumah MEWAH di Arcamanik Endah dkt GRIYA Arcamanik Jln Lebar Strategis,Arcamanik,,4,5,500,350,Rp5.750.000.000
https://www.lamudi.co.id/jual/jawa-barat/bandung/rumah-baru-di-arcamanik-cisaranten-kulon-lokasi-st-17176819682/,Rumah BARU di Arcamanik Cisaranten Kulon Lokasi Strategis Siap Huni,Arcamanik,,2,2,75,100,Rp950.000.000
https://www.lamudi.co.id/jual/jawa-barat/bandung/rumah-minimalis-komplek-arcamanik-endah-perluasan-171768167396/,Rumah Minimalis Komplek Arcamanik Endah Perluasan dkt GRIYA Strategis,Arcamanik,,4,2,106,98,Rp1.450.000.000
https://www.lamudi.co.id/jual/jawa-barat/bandung/rumah-strategis-komplek-arcamanik-sekitar-puri-ayu-171768154157/,Rumah Strategis Komplek Arcamanik Sekitar Puri Ayu Cluster Eklusive,Arcamanik,,3,3,150,102,Rp1.475.000.000
https://www.lamudi.co.id/jual/jawa-barat/bandung/rumah-baru-dua-lantai-minimalis-modern-di-cisarant-171759896012/,Rumah Baru Dua Lantai Minimalis Modern Di Cisaranten Arcamanik,Arcamanik,,3,3,100,100,Rp1.250.000.000
https://www.lamudi.co.id/jual/jawa-barat/bandung/rumah-baru-murah-muka-lebar-setrategis-di-cisarant-171756083953/,Rumah Baru murah muka lebar setrategis di cisaranteun arcamanik -AG,Arcamanik,2,4,2,100,149,Rp1.050.000.000
https://www.lamudi.co.id/jual/jawa-barat/bandung/rumah-asri-di-cisaranten-arcamanik-dalam-kota-band-171754207074/,Rumah Asri di Cisaranten Arcamanik Dalam Kota Bandung,Arcamanik,,3,1,100,300,Rp1.200.000.000
https://www.lamudi.co.id/jual/jawa-barat/bandung/rumah-dilingkungan-cluster-pesona-taman-sari-murah-171820369115/,RUMAH  DILINGKUNGAN CLUSTER PESONA TAMAN SARI MURAH,Arcamanik,,2,1,40,72,Rp499.000.000
https://www.lamudi.co.id/jual/jawa-barat/bandung/rumah-jalan-utama-cisaranten-arcamanik-sekitar-per-171747551233/,Rumah Jalan Utama Cisaranten Arcamanik Sekitar Permata Strategis,Arcamanik,,4,2,240,125,Rp1.350.000.000
https://www.lamudi.co.id/jual/jawa-barat/bandung/rumah-cantik-hunian-eklusive-grand-panoramic-pasir-171747452486/,Rumah Cantik Hunian Eklusive GRAND PANORAMIC Pasir Impun Arcamanik,Arcamanik,,3,3,150,120,Rp1.500.000.000
https://www.lamudi.co.id/jual/jawa-barat/bandung/rumah-murah-dkt-griya-arcamanik-sekitar-permata-el-171747433651/,Rumah MURAH dkt GRIYA Arcamanik Sekitar Permata Elok Jarang ada,Arcamanik,,2,1,85,94,Rp580.000.000
https://www.lamudi.co.id/jual/jawa-barat/bandung/rumah-murah-komplek-cisaranten-kulon-arcamanik-dek-17174736871/,Rumah MURAH Komplek Cisaranten Kulon Arcamanik dekat Masjid Siap Huni,Arcamanik,,5,4,245,186,Rp1.400.000.000
https://www.lamudi.co.id/jual/jawa-barat/bandung/rumah-cantik-minimalis-siap-huni-di-cisaranten-arc-171745911125/,Rumah Cantik Minimalis Siap Huni di Cisaranten Arcamanik,Arcamanik,,3,3,100,100,Rp1.150.000.000
https://www.lamudi.co.id/jual/jawa-barat/bandung/rumah-murah-jatihandap-bandung-171742271830/,Rumah Murah Jatihandap Bandung,Arcamanik,,2,1,36,76,Rp449.000.000
https://www.lamudi.co.id/jual/jawa-barat/bandung/rumah-di-bawah-harga-pasar-cluster-jl-golf-arcaman-171734021186/,Rumah Di Bawah Harga Pasar Cluster Jl Golf Arcamanik Kota Bandung SHM,Arcamanik,1,2,2,113,112,Rp1.300.000.000
https://www.lamudi.co.id/jual/jawa-barat/bandung/rumah-mainroad-cisaranten-arcamanik-skema-syariah-171733791421/,Rumah Mainroad Cisaranten Arcamanik Skema Syariah Bandung Dekat Masjid,Arcamanik,1,2,2,60,60,Rp649.000.000
https://www.lamudi.co.id/jual/jawa-barat/bandung/rumah-baru-bisa-kpr-komplek-cisaranten-dkt-al-ghif-171730999111/,Rumah baru bisa kpr komplek cisaranten dkt al ghifari jalur angkot,Arcamanik,20,3,2,70,95,Rp840.000.000
https://www.lamudi.co.id/jual/jawa-barat/bandung/turun-harga-rumah-siap-huni-di-arcamanik-cisarante-172075700811/,TURUN HARGA RUMAH SIAP HUNI DI ARCAMANIK CISARANTEN,Arcamanik,1,2,1,50,100,Rp740.000.000
https://www.lamudi.co.id/jual/jawa-barat/bandung/dijual-rumah-terawat-di-cisaranten-kulon-arcamanik-171697418324/,"Dijual Rumah terawat di Cisaranten Kulon, Arcamanik",Arcamanik,,2,2,75,100,Rp850.000.000
https://www.lamudi.co.id/jual/jawa-barat/bandung/rumah-murah-komplek-arcamanik-endah-posisi-dpn-dkt-172113775052/,Rumah murah komplek arcamanik endah posisi dpn dkt griya sport center,Arcamanik,50,7,6,500,424,Rp2.999.000.000
https://www.lamudi.co.id/jual/jawa-barat/bandung/rumah-komplek-arcamanik-lokasi-deoan-dkt-griya-spo-171695522840/,Rumah komplek arcamanik lokasi deoan dkt griya sport centre,Arcamanik,30,4,2,140,176,Rp1.299.000.000
https://www.lamudi.co.id/jual/jawa-barat/bandung/rumah-asri-bagus-di-komplek-bumi-parakan-asri-arca-171695404542/,"Rumah asri, bagus di komplek Bumi Parakan Asri Arcamanik. Murah sekali",Arcamanik,1,2,2,80,105,Rp875.000.000
https://www.lamudi.co.id/jual/jawa-barat/bandung/rumah-parakansaat-arcamanik-jual-cepat-via-lelang-171682373734/,Rumah Parakansaat Arcamanik Jual Cepat Via Lelang,Arcamanik,,4,3,277,239,Rp1.650.000.000
https://www.lamudi.co.id/jual/jawa-barat/bandung/rumah-terusan-pesantren-arcamanik-jual-obral-via-l-171682324983/,Rumah Terusan Pesantren Arcamanik Jual Obral Via Lelang,Arcamanik,,4,2,240,120,Rp1.320.000.000
https://www.lamudi.co.id/jual/jawa-barat/bandung/rumah-murah-2-lantai-171679905686/,Rumah Murah 2 Lantai,Arcamanik,2,3,2,210,163,Rp1.900.000.000
https://www.lamudi.co.id/jual/jawa-barat/bandung/rumah-baru-dibangun-171679835389/,Rumah Baru Dibangun,Arcamanik,2,2,2,80,160,Rp1.540.000.000
https://www.lamudi.co.id/jual/jawa-barat/bandung/desain-keren-kota-bandung-171664516787/,Desain Keren Kota Bandung,Arcamanik,,2,2,60,85,Rp980.000.000
https://www.lamudi.co.id/jual/jawa-barat/bandung/rumah-minimalis-cantik-termurah-di-arcamanik-kota-171663008829/,Rumah Minimalis Cantik Termurah di Arcamanik Kota bandung,Arcamanik,,4,4,250,210,Rp4.000.000.000
https://www.lamudi.co.id/jual/jawa-barat/bandung/rumah-murah-siap-huni-dikomplek-taman-melati-pasir-171662289592/,rumah murah siap huni dikomplek taman melati pasir impun,Arcamanik,1,2,2,55,76,Rp635.000.000
https://www.lamudi.co.id/jual/jawa-barat/bandung/rumah-permata-arcamanik-dijual-cepat-via-lelang-171640596024/,Rumah Permata Arcamanik Dijual Cepat Via Lelang,Arcamanik,,4,3,220,271,Rp1.380.000.000
https://www.lamudi.co.id/jual/jawa-barat/bandung/rumah-jalan-golf-arcamanik-obral-jual-via-lelang-171640504747/,Rumah Jalan Golf Arcamanik Obral Jual Via Lelang,Arcamanik,,3,2,220,160,Rp1.500.000.000
https://www.lamudi.co.id/jual/jawa-barat/bandung/dijual-rumah-dalam-komplek-di-pasir-impun-arcamani-17163476877/,Dijual Rumah dalam komplek di Pasir Impun Arcamanik,Arcamanik,,5,5,280,210,Rp1.850.000.000
https://www.lamudi.co.id/jual/jawa-barat/bandung/jual-rumah-tanah-luas-harga-menarik-di-arcamanik-k-171634522389/,Jual Rumah TANAH LUAS harga MENARIK di Arcamanik kota Bandung,Arcamanik,,3,2,70,116,Rp850.000.000
https://www.lamudi.co.id/jual/jawa-barat/bandung/rumah-cantik-model-industrial-bangunan-baru-belaka-171626286063/,"RUMAH CANTIK, MODEL INDUSTRIAL  BANGUNAN BARU BELAKANG GRIYA ARCAMANIK",Arcamanik,2,3,3,131,97,Rp1.175.000.000
https://www.lamudi.co.id/jual/jawa-barat/bandung/rumah-baru-2-lantai-komplek-cisaranten-deket-kampu-171620134181/,Rumah baru 2 lantai komplek cisaranten deket kampus al ghifari,Arcamanik,30,3,2,170,100,Rp1.075.000.000
https://www.lamudi.co.id/jual/jawa-barat/bandung/rumah-komplek-arcamanik-selangkah-ke-sport-center-17162008026/,Rumah komplek arcamanik selangkah ke sport center,Arcamanik,30,3,1,145,177,Rp1.125.000.000
https://www.lamudi.co.id/jual/jawa-barat/bandung/dijual-rumah-komplek-sarimas-arcamanik-lokasi-stra-171617916238/,Dijual Rumah Komplek Sarimas Arcamanik Lokasi Strategis Furnished,Arcamanik,2,5,2,180,182,Rp1.850.000.000
https://www.lamudi.co.id/jual/jawa-barat/bandung/dijual-rumah-2-lantai-cisaranten-arcamanik-bandung-171617811028/,Dijual Rumah 2 Lantai Cisaranten Arcamanik Bandung,Arcamanik,1,4,2,200,120,Rp995.000.000
https://www.lamudi.co.id/jual/jawa-barat/bandung/jual-rumah-cantik-siap-huni-di-arcamanik-kota-band-171617767058/,Jual RUMAH CANTIK siap Huni di Arcamanik kota Bandung,Arcamanik,,3,3,100,100,Rp1.200.000.000
https://www.lamudi.co.id/jual/jawa-barat/bandung/rumah-cisaranten-kulon-arcamanik-bandung-timur-171615881013/,RUMAH CISARANTEN KULON ARCAMANIK BANDUNG TIMUR,Arcamanik,,3,2,90,98,Rp875.000.000
https://www.lamudi.co.id/jual/jawa-barat/bandung/dijual-rumah-komplek-sarimas-arcamanik-siap-huni-171611422434/,Dijual Rumah Komplek Sarimas Arcamanik Siap Huni,Arcamanik,1,3,1,94,108,Rp960.000.000
https://www.lamudi.co.id/jual/jawa-barat/bandung/rumah-asri-luas-besar-di-golf-arcamanik-17160920606/,Rumah Asri Luas Besar di Golf Arcamanik,Arcamanik,4,5,2,160,353,Rp1.850.000.000
https://www.lamudi.co.id/jual/jawa-barat/bandung/jual-rumah-asri-minimalis-strategis-3-menit-dari-g-171609059824/,Jual Rumah Asri Minimalis Strategis 3 menit dari Griya Arcamanik,Arcamanik,3,4,4,259,424,Rp3.150.000.000
https://www.lamudi.co.id/jual/jawa-barat/bandung/dijual-rumah-luas-asri-strategis-di-arcamanik-kota-171608940430/,Dijual Rumah Luas Asri Strategis di Arcamanik Kota Bandung,Arcamanik,3,4,3,250,685,Rp3.950.000.000
https://www.lamudi.co.id/jual/jawa-barat/bandung/rumah-bagus-harga-murah-di-cisaranten-wetan-arcama-171608648293/,Rumah Bagus Harga Murah di Cisaranten Wetan Arcamanik,Arcamanik,,3,2,120,150,Rp950.000.000
https://www.lamudi.co.id/jual/jawa-barat/bandung/rumah-harga-murah-di-cisaranten-kulon-arcamnik-171608558043/,Rumah Harga Murah di Cisaranten Kulon Arcamnik,Arcamanik,,3,1,100,116,Rp675.000.000
https://www.lamudi.co.id/jual/jawa-barat/bandung/rumah-cluster-elit-kamayangan-cingised-172271011618/,Rumah Cluster Elit Kamayangan Cingised,Arcamanik,,2,1,60,78,Rp745.000.000
https://www.lamudi.co.id/jual/jawa-barat/bandung/dijual-cepat-rumah-mewah-dan-megah-golf-arcamanik-171594004050/,Dijual Cepat Rumah Mewah dan Megah Golf Arcamanik Lokasi Strategis,Arcamanik,6,8,10,1350,1031,Rp12.500.000.000
https://www.lamudi.co.id/jual/jawa-barat/bandung/rumah-siap-huni-bersih-dan-terawat-cisaranten-arca-171593949356/,Rumah Siap Huni Bersih dan Terawat Cisaranten Arcamanik Bandung,Arcamanik,1,2,1,60,93,Rp840.000.000
https://www.lamudi.co.id/jual/jawa-barat/bandung/di-jual-rumah-siap-huni-dalam-cluster-di-pinus-reg-171593260857/,Di jual rumah siap huni dalam  Cluster di pinus regency,Arcamanik,1,2,1,90,133,Rp895.000.000
https://www.lamudi.co.id/jual/jawa-barat/bandung/dijual-rumah-dalam-komplek-besar-cisaranten-kulon-171593180297/,Dijual rumah dalam komplek besar cisaranten kulon Arcamanik,Arcamanik,1,2,2,80,100,Rp775.000.000
https://www.lamudi.co.id/jual/jawa-barat/bandung/rumah-cantik-minimalis-di-cisaranten-arcamanik-171591716946/,RUMAH CANTIK MINIMALIS DI CISARANTEN ARCAMANIK,Arcamanik,1,2,1,50,100,Rp795.000.000
https://www.lamudi.co.id/jual/jawa-barat/bandung/property-luxury-lokasi-strategis-dekat-ke-pusat-ko-17158427732/,PROPERTY LUXURY LOKASI STRATEGIS DEKAT KE PUSAT KOTA,Arcamanik,1,2,1,46,72,Rp200.000.000
https://www.lamudi.co.id/jual/jawa-barat/bandung/rumah-full-furnish-bagus-di-arcamanik-bandung-171590929810/,RUMAH FULL FURNISH BAGUS DI ARCAMANIK BANDUNG,Arcamanik,,3,2,135,140,Rp1.900.000.000
https://www.lamudi.co.id/jual/jawa-barat/bandung/murah-rumah-griya-caraka-cisaranten-endah-arcamani-171578419469/,Murah Rumah Griya Caraka Cisaranten Endah Arcamanik,Arcamanik,,4,3,160,180,Rp600.000.000
https://www.lamudi.co.id/jual/jawa-barat/bandung/dijual-rumah-baru-ready-stok-arcamanik-ciskul-mini-17157664774/,Dijual rumah baru ready stok arcamanik ciskul minimalis siap huni,Arcamanik,,3,3,100,100,Rp1.200.000.000
https://www.lamudi.co.id/jual/jawa-barat/bandung/rumah-baru-2-lantai-lokasi-di-arcamanik-cisaranten-171920405353/,RUMAH BARU 2 LANTAI LOKASI DI ARCAMANIK CISARANTEN BANDUNG,Arcamanik,2,3,3,100,100,Rp1.200.000.000
https://www.lamudi.co.id/jual/jawa-barat/bandung/dijual-rumah-di-komplek-cisaranten-171567418012/,Dijual rumah di komplek cisaranten,Arcamanik,1,4,2,120,144,Rp950.000.000
https://www.lamudi.co.id/jual/jawa-barat/bandung/dijual-rumah-dekat-sor-arcamanik-luas177-145-hrg1-171531774013/,"Dijual rumah dekat SOR Arcamanik luas177/145 hrg1,3m Kota bandung",Arcamanik,1,3,1,145,177,Rp1.300.000.000
https://www.lamudi.co.id/jual/jawa-barat/bandung/rumah-baru-siaphuni-dekat-kampus-lt100-170-harga1-17153142835/,"rumah baru siaphuni dekat kampus lt100/170 harga1,3m arcamanik bandung",Arcamanik,2,3,2,177,100,Rp1.300.000.000
https://www.lamudi.co.id/jual/jawa-barat/bandung/ual-rumah-baru-siap-huni-di-komplek-purbasari-inda-171515932062/,UAL RUMAH BARU SIAP HUNI DI KOMPLEK PURBASARI INDAH NO 7 ARCAMANIK.,Arcamanik,2,3,3,133,100,Rp1.350.000.000
https://www.lamudi.co.id/jual/jawa-barat/bandung/murah-rumah-luas327-120-harga-1-65m-di-komp-arcama-171515252297/,"Murah  rumah luas327/120 harga 1,65m di komp arcamanik bandung",Arcamanik,,3,2,122,327,Rp1.650.000.000
https://www.lamudi.co.id/jual/jawa-barat/bandung/dijual-rumah-cluster-berlian-di-arcamanik-171506979629/,Dijual Rumah Cluster Berlian di Arcamanik,Arcamanik,,2,2,68,97,Rp780.000.000
https://www.lamudi.co.id/jual/jawa-barat/bandung/rumah-mewah-lux-semi-furnish-di-arcamanik-kota-ban-171506407715/,Rumah Mewah Lux Semi Furnish di Arcamanik Kota Bandung Siap Huni,Arcamanik,4,15,12,1350,1031,Rp12.500.000.000
https://www.lamudi.co.id/jual/jawa-barat/bandung/dijual-rumah-di-arcamanik-siap-huni-171505474940/,Dijual Rumah di Arcamanik siap huni,Arcamanik,,3,2,160,327,Rp1.850.000.000
https://www.lamudi.co.id/jual/jawa-barat/bandung/murah-banget-jual-rumah-di-arcamanik-600-jutaan-ru-171496865889/,MURAH Banget Jual Rumah di Arcamanik 600 jutaan rumah BARU Masuk MOBIL,Arcamanik,,2,1,40,72,Rp675.000.000
https://www.lamudi.co.id/jual/jawa-barat/bandung/dijual-rumah-arcamanik-strategis-dekst-ke-griya-ar-171472071625/,Dijual Rumah Arcamanik strategis dekst ke Griya arcamanik Bandung,Arcamanik,,7,4,288,176,Rp2.200.000.000
https://www.lamudi.co.id/jual/jawa-barat/bandung/rumah-tropical-industrial-siap-huni-backyard-di-ar-171751729169/,Rumah Tropical Industrial Siap Huni Backyard Di Arcamanik Kota Bandung,Arcamanik,2,5,4,180,133,Rp1.850.000.000
https://www.lamudi.co.id/jual/jawa-barat/bandung/dijual-rumah-murah-hitung-tanah-di-arcamanik-endah-171470949036/,dijual rumah murah hitung tanah di arcamanik endah,Arcamanik,3,3,2,120,327,Rp1.650.000.000
https://www.lamudi.co.id/jual/jawa-barat/bandung/dijual-rumah-baru-di-komplek-cisaranten-kulon-arca-171456547450/,Dijual Rumah Baru di komplek Cisaranten kulon Arcamanik Bandung Kota,Arcamanik,2,4,3,115,100,Rp995.000.000
https://www.lamudi.co.id/jual/jawa-barat/bandung/rumah-baru-bagus-siap-huni-di-cisaranten-arcamanik-171451688586/,RUMAH BARU BAGUS SIAP HUNI DI CISARANTEN ARCAMANIK BANDUNG,Arcamanik,,3,3,100,100,Rp1.200.000.000
https://www.lamudi.co.id/jual/jawa-barat/bandung/rumah-siap-huni-di-permata-taman-asri-cisaranten-a-171446517665/,Rumah Siap Huni Di Permata Taman Asri Cisaranten Arcamanik Bandung KPR,Arcamanik,1,2,1,50,78,Rp670.000.000
https://www.lamudi.co.id/jual/jawa-barat/bandung/dijual-rumah-baru-renov-1-5-lantai-di-puri-dago-17146350479/,"Dijual rumah baru renov 1,5 lantai di puri dago",Arcamanik,1,4,2,100,98,Rp990.000.000
https://www.lamudi.co.id/jual/jawa-barat/bandung/rumah-cantik-minimalis-puri-dago-antapani-171445521614/,Properti Dijual di Bandung,Arcamanik,,,,,,Rp4.000.000.000
https://www.lamudi.co.id/jual/jawa-barat/bandung/rumah-baru-antapani-minimalis-kontemporer-171437760375/,RUMAH BARU ANTAPANI MINIMALIS KONTEMPORER,Arcamanik,1,3,3,106,70,Rp1.145.000.000
https://www.lamudi.co.id/jual/jawa-barat/bandung/dijual-rumah-baru-tinggal-1-unit-lg-di-komplek-cis-171437476342/,Dijual Rumah Baru tinggal 1 unit lg di komplek Ciskul Arcamanik,Arcamanik,,4,2,100,115,Rp1.099.000.000
https://www.lamudi.co.id/jual/jawa-barat/bandung/rumah-sari-mas-arcamanik-dijual-cepat-nego-171428561286/,Rumah Sari Mas Arcamanik Dijual Cepat Nego,Arcamanik,,4,3,288,216,Rp1.900.000.000
https://www.lamudi.co.id/jual/jawa-barat/bandung/rumah-1-lantai-di-komplek-antapani-kota-bandung-st-17141955211/,Rumah 1 lantai di Komplek Antapani Kota Bandung strategis,Arcamanik,1,2,1,70,105,Rp1.050.000.000
https://www.lamudi.co.id/jual/jawa-barat/bandung/rumah-full-furnished-posisi-hook-di-arcamanik-band-171417414126/,RUMAH FULL FURNISHED POSISI HOOK DI ARCAMANIK BANDUNG,Arcamanik,,4,3,150,142,Rp2.650.000.000
https://www.lamudi.co.id/jual/jawa-barat/bandung/dijual-rumah-siap-huni-furnished-strategis-kawasan-171638463764/,Dijual Rumah Siap Huni Furnished Strategis Kawasan Arcamanik Antapani,Arcamanik,,4,4,208,300,Rp2.900.000.000
https://www.lamudi.co.id/jual/jawa-barat/bandung/rumah-hook-mewah-semi-furnished-di-arcamanik-kota-17141232449/,Rumah Hook Mewah Semi Furnished Di Arcamanik Kota Bandung,Arcamanik,2,15,12,1350,1031,Rp12.500.000.000
https://www.lamudi.co.id/jual/jawa-barat/bandung/turun-harga-dr-2-2m-jadi-1-65m-rumah-luas327-120-d-171411416879/,"Turun harga dr 2,2m jadi 1,65m rumah luas327/120 di arcamanik bandung",Arcamanik,2,3,2,122,327,Rp1.650.000.000
https://www.lamudi.co.id/jual/jawa-barat/bandung/rumah-hitung-tanah-lokasi-strategis-di-arcamanik-171411065855/,Rumah hitung Tanah lokasi strategis di arcamanik,Arcamanik,,3,2,327,120,Rp1.649.000.000
https://www.lamudi.co.id/proyek/arcamanik-endah/rumah-hook-komplek-arcamanik-endah-dkt-terminal-an-171806995994/,Rumah hook komplek arcamanik endah dkt terminal antapani,Arcamanik,50,3,2,120,327,Rp2.500.000.000
https://www.lamudi.co.id/jual/jawa-barat/bandung/rumah-arcamanik-bandung-premium-171408514949/,Rumah Arcamanik Bandung Premium,Arcamanik,1,4,3,150,142,Rp2.650.000.000
