Link,Judul,Kecamatan,Lahan Parkir,Kamar Tidur,Kamar Mandi,Luas Bangunan,Luas Tanah,Harga
https://www.lamudi.co.id/jual/jawa-barat/bandung/dijual-rumah-terawat-arcamanik-siap-huni-harga-njo-172372086440/,Dijual Rumah Terawat Arcamanik Siap Huni Harga Njop Dalam Komplek,Arcamanik,2,3,2,240,331,Rp2.500.000.000
https://www.lamudi.co.id/jual/jawa-barat/bandung/rumah-siap-huni-golp-arcamanik-bandung-172343191266/,Rumah siap huni golp arcamanik bandung,Arcamanik,2,4,2,220,231,Rp2.500.000.000
https://www.lamudi.co.id/jual/jawa-barat/bandung/dijual-rumah-murah-siap-huni-di-komplek-permata-bi-172310146417/,Dijual rumah murah siap huni di komplek permata biru,Arcamanik,1,2,1,61,89,Rp350.000.000
https://www.lamudi.co.id/jual/jawa-barat/bandung/dijual-rumah-murah-575jt-minimalis-siap-huni-cisar-172240264620/,"Dijual rumah MURAH 575jt MINIMALIS siap huni Cisaranten, Hadap TIMUR",Arcamanik,1,2,1,45,100,Rp575.000.000
https://www.lamudi.co.id/jual/jawa-barat/bandung/jual-rumah-ex-cafe-arcamanik-bandung-171083093687/,Jual Rumah ex cafe  Arcamanik Bandung,Arcamanik,,4,3,137,114,Rp2.400.000.000
https://www.lamudi.co.id/jual/jawa-barat/bandung/dijual-rumah-murah-harga-di-bawah-pasaran-di-cisar-172065074219/,Dijual rumah murah harga di bawah pasaran di cisaranten arcamanik,Arcamanik,,4,3,150,118,Rp875.000.000
https://www.lamudi.co.id/jual/jawa-barat/bandung/dijual-rumah-di-cisaranten-kulon-arcamanik-sayap-a-172402329416/,DIJUAL RUMAH DI CISARANTEN KULON ARCAMANIK SAYAP ANTAPANI SPORT JABAR,Arcamanik,1,3,2,75,100,Rp695.000.000
https://www.lamudi.co.id/jual/jawa-barat/bandung/dijual-rumah-2-lantai-ready-full-furnished-arcaman-172398627096/,Dijual Rumah 2 Lantai Ready Full Furnished Arcamanik Endah SHM,Arcamanik,,3,3,135,147,Rp2.300.000.000
https://www.lamudi.co.id/jual/jawa-barat/bandung/dijual-rumah-modren-minimalis-city-view-sayap-arca-17239817706/,"Dijual Rumah Modren Minimalis City View Sayap Arcamanik, Kota Bandung",Arcamanik,1,3,3,150,120,Rp1.500.000.000
https://www.lamudi.co.id/jual/jawa-barat/bandung/dijual-rumah-di-daerah-arcamanik-bandung-cluster-e-172396874065/,Dijual rumah di daerah Arcamanik Bandung cluster edelweis,Arcamanik,,4,2,85,84,Rp950.000.000
https://www.lamudi.co.id/jual/jawa-barat/bandung/jarang-rumah-strategis-pasirimpun-bandung-take-ove-172396178811/,Jarang..Rumah Strategis Pasirimpun Bandung Take Over Tanpa BI Checking,Arcamanik,2,2,2,72,69,Rp695.000.000
https://www.lamudi.co.id/jual/jawa-barat/bandung/rumah-lama-di-arcamanik-endah-172391073665/,Rumah Lama Di Arcamanik Endah,Arcamanik,,2,1,54,99,Rp800.000.000
https://www.lamudi.co.id/jual/jawa-barat/bandung/rmh-bagus-di-ters-pesantren-arcamanik-17239029043/,"rmh bagus di Ters. Pesantren, Arcamanik",Arcamanik,,5,5,350,735,Rp6.500.000.000
https://www.lamudi.co.id/jual/jawa-barat/bandung/rumah-bagus-2-lti-di-arcamanik-endah-puri-ayu-prat-172390290125/,Rumah bagus 2 Lti di ARCAMANIK ENDAH (Puri Ayu Pratama),Arcamanik,,4,4,205,300,Rp2.800.000.000
https://www.lamudi.co.id/jual/jawa-barat/bandung/rumah-murah-bangunan-bagus-dan-strategis-172390280854/,Rumah Murah Bangunan Bagus dan Strategis,Arcamanik,,2,1,46,66,Rp492.900.000
https://www.lamudi.co.id/jual/jawa-barat/bandung/rumah-siap-ditempati-di-kota-172390233388/,Rumah Siap Ditempati Di Kota,Arcamanik,,2,1,45,67,Rp593.900.000
https://www.lamudi.co.id/jual/jawa-barat/bandung/arcamanik-murah-dibawah-pasaran-bu-cpt-nego-172389615978/,"arcamanik murah dibawah pasaran, BU CPT, nego",Arcamanik,,7,7,500,425,Rp2.985.000.000
https://www.lamudi.co.id/jual/jawa-barat/bandung/rumah-terawat-arcamanik-harga-dibawah-pasaran-172387425287/,Rumah Terawat Arcamanik Harga Dibawah Pasaran,Arcamanik,2,3,2,240,331,Rp2.500.000.000
https://www.lamudi.co.id/jual/jawa-barat/bandung/siap-huni-rumah-acamanik-bandung-dekat-griya-arcam-172385672873/,Siap huni rumah acamanik bandung dekat griya arcamanik,Arcamanik,3,4,3,330,220,Rp2.900.000.000
https://www.lamudi.co.id/jual/jawa-barat/bandung/rumah-taman-golf-arcamanik-2-lantai-jual-murah-cep-172382775897/,Rumah Taman Golf Arcamanik 2 Lantai Jual Murah Cepat,Arcamanik,,4,2,139,137,Rp861.100.000
https://www.lamudi.co.id/jual/jawa-barat/bandung/rumah-cisaranten-arcamanik-scandinavian-2-lantai-s-172382430177/,"RUMAH CISARANTEN ARCAMANIK SCANDINAVIAN
2 LANTAI SHM",Arcamanik,,5,4,170,120,Rp1.350.000.000
https://www.lamudi.co.id/jual/jawa-barat/bandung/rumah-dua-lantai-golf-arcamanik-172381846967/,RUMAH DUA LANTAI GOLF ARCAMANIK,Arcamanik,1,3,3,300,220,Rp2.900.000.000
https://www.lamudi.co.id/jual/jawa-barat/bandung/rumah-siap-huni-posisi-hook-di-arcamanik-172381227847/,Rumah Siap Huni Posisi Hook Di Arcamanik,Arcamanik,,3,3,135,147,Rp2.300.000.000
https://www.lamudi.co.id/jual/jawa-barat/bandung/dijual-rumah-lama-lokasi-arcamanik-172380968548/,Dijual Rumah Lama Lokasi Arcamanik,Arcamanik,,2,1,54,99,Rp800.000.000
https://www.lamudi.co.id/jual/jawa-barat/bandung/rumah-siap-huni-arcamanik-endah-sayap-terusah-jaka-172380088793/,"Rumah siap huni Arcamanik Endah, sayap Terusah Jakarata",Arcamanik,,3,2,135,124,Rp1.200.000.000
https://www.lamudi.co.id/jual/jawa-barat/bandung/jual-rumah-tinggal-siap-huni-minimalis-modern-arca-172378987514/,Jual Rumah tinggal siap huni minimalis modern Arcamanik,Arcamanik,1,4,4,173,173,Rp1.600.000.000
https://www.lamudi.co.id/jual/jawa-barat/bandung/rumah-murah-di-arcamanik-172378460965/,Rumah Murah di Arcamanik,Arcamanik,,3,3,90,140,Rp780.000.000
https://www.lamudi.co.id/jual/jawa-barat/bandung/dijual-rumah-hook-1-5-lantai-arcamanik-sindanglaya-172377798729/,"Dijual Rumah Hook 1,5 Lantai Arcamanik Sindanglaya Bandung",Arcamanik,2,5,5,200,185,Rp1.500.000.000
https://www.lamudi.co.id/jual/jawa-barat/bandung/dijual-rumah-minimalis-di-perumahan-arcamanik-172377378876/,Dijual Rumah Minimalis di Perumahan Arcamanik,Arcamanik,2,4,4,155,119,Rp1.300.000.000
https://www.lamudi.co.id/jual/jawa-barat/bandung/rumah-siap-huni-tanpa-dp-promo-kemerdekaan-172373357169/,Rumah siap huni tanpa Dp promo kemerdekaan,Arcamanik,,2,1,40,62,Rp400.000.000
https://www.lamudi.co.id/jual/jawa-barat/bandung/rumah-2-lantai-komolek-cisaranten-dkt-sport-center-17237180586/,Rumah 2 lantai komolek cisaranten dkt sport center arcamanik,Arcamanik,15,3,2,100,100,Rp950.000.000
https://www.lamudi.co.id/jual/jawa-barat/bandung/tanah-luas-bonus-bangunan-di-cisaranten-arcamanik-172371790258/,TANAH LUAS BONUS BANGUNAN DI CISARANTEN ARCAMANIK ANTAPANI,Arcamanik,1,3,1,122,232,Rp900.000.000
https://www.lamudi.co.id/jual/jawa-barat/bandung/rumah-bagudms-murah-cluster-cisaranten-arcamanik-172372373843/,Rumah bagudms murah cluster cisaranten arcamanik,Arcamanik,15,5,4,150,160,Rp990.000.000
https://www.lamudi.co.id/jual/jawa-barat/bandung/murah-rumah-lt90-90-hrg450jt-pajajaran-pasir-impun-17237011625/,Murah Rumah Lt90/90 Hrg450jt Pajajaran pasir impun Arcamanik Bandung,Arcamanik,,3,2,90,90,Rp450.000.000
https://www.lamudi.co.id/jual/jawa-barat/bandung/rumah-cisaranten-arcamanik-bandung-gaya-scandinavi-172369867237/,Rumah Cisaranten Arcamanik Bandung Gaya Scandinavian on Progress,Arcamanik,,2,2,55,90,Rp750.000.000
https://www.lamudi.co.id/jual/jawa-barat/bandung/dijual-cepat-harus-laku-segera-lagi-butuh-rumah-cl-172371077615/,"DIJUAL CEPAT  Harus Laku Segera, Lagi Butuh rumah cluster Cisaranten",Arcamanik,1,3,3,150,160,Rp995.000.000
https://www.lamudi.co.id/jual/jawa-barat/bandung/rumah-cisaranten-arcamanik-bandung-shm-terawat-sia-17236918576/,Rumah Cisaranten Arcamanik Bandung SHM Terawat Siap Huni,Arcamanik,,2,1,40,72,Rp620.000.000
https://www.lamudi.co.id/jual/jawa-barat/bandung/dijual-rumah-lahan-luas-asri-yaman-di-arcamanik-172368457278/,dijual rumah lahan luas asri yaman di arcamanik,Arcamanik,2,4,3,200,2035,Rp10.000.000.000
https://www.lamudi.co.id/jual/jawa-barat/bandung/murah-rumah-taman-golf-arcamanik-jl-atletik-vii-172364033488/,Murah Rumah Taman Golf Arcamanik Jl Atletik VII,Arcamanik,,4,2,139,137,Rp861.000.000
https://www.lamudi.co.id/jual/jawa-barat/bandung/jual-rumah-cantik-banget-2-lantai-di-arcamanik-700-172363487393/,Jual Rumah CANTIK BANGET 2 Lantai di Arcamanik 700 jutaan,Arcamanik,,2,2,55,63,Rp770.000.000
https://www.lamudi.co.id/jual/jawa-barat/bandung/dijual-cepat-rumah-lama-terawat-di-arcamanik-172362515844/,Dijual Cepat Rumah lama terawat Di Arcamanik,Arcamanik,1,4,2,85,133,Rp1.000.000.000
https://www.lamudi.co.id/jual/jawa-barat/bandung/rumah-minimalis-siap-huni-di-arcamanik-172362458666/,Rumah Minimalis Siap Huni Di Arcamanik,Arcamanik,1,3,2,120,114,Rp1.450.000.000
https://www.lamudi.co.id/jual/jawa-barat/bandung/jual-rumah-2-lantai-townhouse-evergreen-bandung-17236224139/,JUAL RUMAH 2 LANTAI  TOWNHOUSE EVERGREEN BANDUNG,Arcamanik,,4,3,104,84,Rp1.200.000.000
https://www.lamudi.co.id/jual/jawa-barat/bandung/dijual-rumah-di-cluster-arcamanik-pasir-impun-huni-172361229055/,Dijual rumah di cluster arcamanik pasir impun Hunian Asri dan Sejuk,Arcamanik,1,3,3,150,120,Rp1.499.000.000
https://www.lamudi.co.id/jual/jawa-barat/bandung/dijual-cepat-rumah-minimalis-siap-huni-cisaranten-172403926490/,Dijual CEPAT  Rumah Minimalis siap huni Cisaranten Kulon dekat GRIYA,Arcamanik,1,3,2,110,100,Rp945.000.000
https://www.lamudi.co.id/jual/jawa-barat/bandung/dijual-rumah-2-lantai-siap-huni-cisaranten-kulon-i-172354836660/,Dijual rumah 2 lantai siap huni Cisaranten Kulon II Arcamanik,Arcamanik,,3,2,100,100,Rp950.000.000
https://www.lamudi.co.id/jual/jawa-barat/bandung/rumah-nuansa-villa-bandung-padasuka-asri-di-jatiha-172354181884/,rumah nuansa villa bandung padasuka asri di jatihandap dkt pusdai,Arcamanik,20,3,2,55,68,Rp680.000.000
https://www.lamudi.co.id/jual/jawa-barat/bandung/rumah-menghadap-fasum-taman-anak-di-arcamak-endah-172354086173/,Rumah menghadap fasum taman anak di Arcamak Endah Bandung,Arcamanik,,5,3,176,176,Rp1.800.000.000
https://www.lamudi.co.id/jual/jawa-barat/bandung/dijual-rumah-nyaman-siap-huni-di-komplek-arcamanik-172353333592/,Dijual Rumah Nyaman Siap Huni di Komplek Arcamanik Endah Bandung,Arcamanik,,2,1,54,99,Rp800.000.000
https://www.lamudi.co.id/jual/jawa-barat/bandung/rumah-dijual-cepat-2-lantai-di-cisaranten-kulon-ar-172352668520/,Rumah dijual cepat 2 lantai di Cisaranten Kulon Arcamanik Kota Bandung,Arcamanik,1,3,2,100,100,Rp950.000.000
https://www.lamudi.co.id/jual/jawa-barat/bandung/rumah-baru-modern-minimalis-cisaranten-kulon-perma-17235230751/,Rumah Baru Modern Minimalis Cisaranten Kulon Permata Inten Arcamanik,Arcamanik,,4,4,155,120,Rp1.300.000.000
https://www.lamudi.co.id/jual/jawa-barat/bandung/rumah-dijual-cepat-1-lantai-tanah-luas-lokasi-supe-172352283369/,Rumah dijual cepat 1 lantai tanah luas lokasi super strategis,Arcamanik,1,2,1,60,144,Rp1.100.000.000
https://www.lamudi.co.id/jual/jawa-barat/bandung/rumah-2-lantai-dijual-cepat-baru-renovasi-di-buana-172352245893/,Rumah 2 lantai dijual cepat baru renovasi di Buana Soetta Residence,Arcamanik,1,3,2,86,95,Rp1.750.000.000
https://www.lamudi.co.id/jual/jawa-barat/bandung/rumah-dijual-cepat-terawat-lokasi-super-strategis-172352211670/,Rumah dijual cepat terawat lokasi super strategis di Cisaranten Kulon,Arcamanik,1,3,2,180,120,Rp1.400.000.000
https://www.lamudi.co.id/jual/jawa-barat/bandung/rumah-dijual-cepat-bangunan-kokoh-2-lantai-nyaman-172352163348/,Rumah dijual cepat bangunan kokoh 2 lantai nyaman terawat strategis,Arcamanik,2,4,3,150,155,Rp1.900.000.000
https://www.lamudi.co.id/jual/jawa-barat/bandung/rumah-dijual-cepat-bangunan-kokoh-2-lantai-lokasi-172352056137/,Rumah dijual cepat bangunan kokoh 2 lantai lokasi super strategis,Arcamanik,1,5,3,200,124,Rp1.700.000.000
https://www.lamudi.co.id/jual/jawa-barat/bandung/cisaranten-kulon-arcamanik-bandung-kota-172351962284/,CISARANTEN KULON ARCAMANIK BANDUNG KOTA,Arcamanik,,3,2,70,63,Rp835.000.000
https://www.lamudi.co.id/jual/jawa-barat/bandung/rumah-siap-huni-di-arcamanik-permata-permai-172350640128/,Rumah siap huni di arcamanik permata permai,Arcamanik,,2,1,40,72,Rp630.000.000
https://www.lamudi.co.id/jual/jawa-barat/bandung/jual-murah-rumah-strategis-tanah-98-di-antapani-ar-172350419482/,Jual Murah Rumah Strategis Tanah 98 di Antapani arcamanik Bandung,Arcamanik,1,4,2,100,98,Rp990.000.000
https://www.lamudi.co.id/jual/jawa-barat/bandung/rumah-minimalis-arcamanik-murah-172347970236/,Rumah Minimalis Arcamanik Murah,Arcamanik,1,4,4,120,147,Rp2.300.000.000
https://www.lamudi.co.id/jual/jawa-barat/bandung/dijual-murah-rumah-siap-huni-di-komp-pertama-arcam-172335385589/,Dijual Murah Rumah Siap Huni di Komp. Pertama Arcamanik Bandung Kota,Arcamanik,1,23,1,90,124,Rp670.000.000
https://www.lamudi.co.id/jual/jawa-barat/bandung/rumah-cantik-nyaman-strategis-di-arcamanik-jl-golf-172329783660/,Rumah Cantik Nyaman Strategis di Arcamanik Jl Golf,Arcamanik,,6,4,200,240,Rp2.750.000.000
https://www.lamudi.co.id/jual/jawa-barat/bandung/rumah-murah-di-arcamanik-dekat-sport-jabar-172328390262/,Rumah Murah Di Arcamanik Dekat Sport Jabar,Arcamanik,1,2,1,54,99,Rp800.000.000
https://www.lamudi.co.id/jual/jawa-barat/bandung/rumah-bagus-1-lantai-di-arcamanik-172327199659/,Rumah Bagus 1 Lantai di Arcamanik,Arcamanik,1,3,2,72,88,Rp1.050.000.000
https://www.lamudi.co.id/jual/jawa-barat/bandung/rumah-strategis-terletak-di-pusat-kota-plus-kitche-172326538727/,Rumah Strategis terletak di Pusat Kota plus Kitchen Set,Arcamanik,,3,2,119,85,Rp1.299.500.000
https://www.lamudi.co.id/jual/jawa-barat/bandung/rumah-siap-huni-lokasi-strategis-di-arcamanik-172325327480/,RUMAH SIAP HUNI LOKASI STRATEGIS DI ARCAMANIK,Arcamanik,2,4,2,85,133,Rp1.050.000.000
https://www.lamudi.co.id/jual/jawa-barat/bandung/rumah-baru-konsep-unik-172321175245/,Rumah Baru Konsep Unik,Arcamanik,,2,2,59,72,Rp674.635.000
https://www.lamudi.co.id/jual/jawa-barat/bandung/langka-rumah-murah-terawat-shm-bonus-2-ruko-di-arc-172320460710/,Langka! Rumah Murah Terawat SHM Bonus 2 Ruko di Arcamanik Kota Bandung,Arcamanik,424,5,5,500,424,Rp3.000.000.000
https://www.lamudi.co.id/jual/jawa-barat/bandung/jarang-ada-rumah-baru-di-arcamanik-dkt-smpn-17-ban-172320096750/,JARANG ADA Rumah Baru di Arcamanik dkt SMPN 17 Bandung,Arcamanik,,2,2,55,90,Rp750.000.000
https://www.lamudi.co.id/jual/jawa-barat/bandung/rumah-di-antapani-sayap-pasir-impun-172319703412/,Rumah Di Antapani Sayap Pasir Impun,Arcamanik,1,4,4,250,192,Rp1.750.000.000
https://www.lamudi.co.id/jual/jawa-barat/bandung/rumah-baru-full-furnish-di-golf-barat-arcamanik-ko-172319138557/,"Rumah Baru Full Furnish di Golf Barat, Arcamanik - Kota Bandung",Arcamanik,,3,4,135,147,Rp2.300.000.000
https://www.lamudi.co.id/jual/jawa-barat/bandung/dijual-rumah-minimalis-siap-huni-di-purbasari-inda-172318527033/,DIJUAL RUMAH MINIMALIS SIAP HUNI DI PURBASARI INDAH I ARCAMANIK,Arcamanik,1,3,2,120,114,Rp1.450.000.000
https://www.lamudi.co.id/jual/jawa-barat/bandung/jual-cepat-rumah-luas-carport-besar-hermina-arcama-172318128833/,"Jual Cepat Rumah LUAS, CARPORT BESAR Hermina Arcamanik, UjungBerung",Arcamanik,,6,4,200,145,Rp1.900.000.000
https://www.lamudi.co.id/jual/jawa-barat/bandung/rumah-gress-ekslusif-cluster-villa-tropis-sindangl-172316767968/,RUMAH GRESS EKSLUSIF CLUSTER VILLA TROPIS SINDANGLAYA ARCAMANIK (RQ),Arcamanik,1,3,2,60,71,Rp654.000.000
https://www.lamudi.co.id/jual/jawa-barat/bandung/rumah-minimalis-1-lantai-500-jutaan-hanya-1-unit-s-172310934787/,Rumah minimalis 1 lantai 500 jutaan hanya 1 unit saja di Cisaranten,Arcamanik,1,2,1,40,65,Rp595.000.000
https://www.lamudi.co.id/jual/jawa-barat/bandung/jual-cepat-rumah-siap-huni-di-akses-jalan-lebar-di-172309185947/,JUAL CEPAT RUMAH SIAP HUNI DI AKSES JALAN LEBAR DI ARCAMANIK BANDUNG,Arcamanik,2,4,2,120,162,Rp1.700.000.000
https://www.lamudi.co.id/jual/jawa-barat/bandung/lelang-bank-rumah-dibawah-harga-pasar-di-grand-pin-172308841854/,LELANG BANK Rumah dibawah Harga Pasar di Grand Pinus Arcamanik,Arcamanik,,2,1,46,115,Rp579.000.000
https://www.lamudi.co.id/jual/jawa-barat/bandung/rumah-baru-harga-lama-835-jt-tanah-142-mtr-cisaran-172303899080/,Rumah baru harga lama 835 jt tanah 142 mtr cisaranten arcananik,Arcamanik,15,3,1,75,142,Rp835.000.000
https://www.lamudi.co.id/jual/jawa-barat/bandung/rumah-terawat-siap-huni-di-arcamanik-bandung-timur-172303547827/,RUMAH TERAWAT SIAP HUNI DI ARCAMANIK BANDUNG TIMUR,Arcamanik,1,2,2,75,112,Rp1.200.000.000
https://www.lamudi.co.id/jual/jawa-barat/bandung/dijual-rumah-cantik-mewah-di-arcamanik-golf-barat-172297204978/,Dijual.Rumah Cantik & Mewah Di Arcamanik Golf Barat Bandung,Arcamanik,,4,5,480,333,Rp5.750.000.000
https://www.lamudi.co.id/jual/jawa-barat/bandung/dijual-rumah-cantik-asri-di-green-caraka-residence-17229711972/,Dijual Rumah Cantik & Asri Di Green Caraka Residence,Arcamanik,,4,2,150,135,Rp700.000.000
https://www.lamudi.co.id/jual/jawa-barat/bandung/rumah-2-lantai-shm-di-arcamanik-antapani-kota-band-172294071499/,Rumah 2 lantai SHM di Arcamanik Antapani Kota Bandung,Arcamanik,,4,4,180,99,Rp1.500.000.000
https://www.lamudi.co.id/jual/jawa-barat/bandung/rumah-full-furnished-area-pinus-regency-arcamanik-172293821251/,Rumah Full Furnished Area Pinus Regency Arcamanik,Arcamanik,1,3,3,170,120,Rp1.500.000.000
https://www.lamudi.co.id/jual/jawa-barat/bandung/rumah-terawat-di-cisaranten-arcamanik-bandung-172292838785/,RUMAH TERAWAT DI CISARANTEN ARCAMANIK BANDUNG,Arcamanik,,2,2,90,100,Rp925.000.000
https://www.lamudi.co.id/jual/jawa-barat/bandung/rumah-baru-bangun-siap-huni-arcamanik-cisaranten-172292345754/,Rumah Baru Bangun Siap Huni Arcamanik-cisaranten,Arcamanik,2,4,4,155,119,Rp1.300.000.000
https://www.lamudi.co.id/jual/jawa-barat/bandung/rumah-cantik-luas-asri-sangat-terawat-di-arcamanik-17229192570/,"Rumah cantik,luas, asri sangat terawat di Arcamanik",Arcamanik,4,5,5,364,500,Rp4.890.000.000
https://www.lamudi.co.id/jual/jawa-barat/bandung/rumah-luas-di-dalam-komplek-arcamanik-sayap-antapa-17229149640/,RUMAH LUAS DI DALAM KOMPLEK ARCAMANIK SAYAP ANTAPANI,Arcamanik,1,4,3,190,230,Rp1.675.000.000
https://www.lamudi.co.id/jual/jawa-barat/bandung/siap-huni-termurah-di-kota-dekat-dago-172286641918/,Siap Huni Termurah Di Kota dekat Dago,Arcamanik,,2,1,46,68,Rp595.000.000
https://www.lamudi.co.id/jual/jawa-barat/bandung/rumah-nyaman-siap-huni-area-arcamanik-lingkungan-h-172291968182/,RUMAH NYAMAN SIAP HUNI AREA ARCAMANIK LINGKUNGAN HENING,Arcamanik,,3,2,105,120,Rp850.000.000
https://www.lamudi.co.id/jual/jawa-barat/bandung/dijual-cepat-rumah-cisaranten-kulon-arcamanik-kama-172285432718/,"Dijual CEPAT Rumah Cisaranten Kulon Arcamanik, Kamar 4, LT 118m/133m",Arcamanik,1,4,3,133,118,Rp800.000.000
https://www.lamudi.co.id/jual/jawa-barat/bandung/dijual-rumah-lama-komplek-arcamanik-endah-lokasi-s-172285223014/,Dijual rumah lama komplek Arcamanik Endah Lokasi Strategis Luas 176m,Arcamanik,2,4,2,140,176,Rp1.300.000.000
https://www.lamudi.co.id/jual/jawa-barat/bandung/dijual-rumah-komplek-arcamanik-endah-lingkungan-ny-172285210972/,Dijual rumah Komplek Arcamanik Endah Lingkungan Nyaman Bagus Strategis,Arcamanik,1,3,1,120,99,Rp990.000.000
https://www.lamudi.co.id/jual/jawa-barat/bandung/dijual-rumah-minimalis-siap-huni-komplek-arcamanik-172285165541/,Dijual rumah MINIMALIS Siap Huni komplek Arcamanik Endah dekat GRIYA,Arcamanik,1,4,2,110,98,Rp1.400.000.000
https://www.lamudi.co.id/jual/jawa-barat/bandung/dijual-rumah-siap-huni-komplek-arcamanik-endah-dek-17228515373/,"Dijual rumah SIAP HUNI, komplek Arcamanik Endah! Dekat SPORT JABAR",Arcamanik,1,3,3,150,102,Rp1.375.000.000
https://www.lamudi.co.id/jual/jawa-barat/bandung/rumah-bagus-siap-huni-arcamanik-cisaranten-murah-172284418580/,Rumah bagus siap huni Arcamanik Cisaranten Murah,Arcamanik,,2,1,50,100,Rp740.000.000
https://www.lamudi.co.id/jual/jawa-barat/bandung/rumah-2-lantai-terawat-one-gate-arcamanik-bandung-172283908775/,Rumah 2 Lantai Terawat One Gate  Arcamanik Bandung Kota,Arcamanik,,3,2,135,104,Rp1.200.000.000
https://www.lamudi.co.id/jual/jawa-barat/bandung/rumah-baru-siap-huni-arcamanik-bandung-murah-jaran-172283882954/,Rumah Baru Siap Huni Arcamanik Bandung Murah Jarang Ada,Arcamanik,,3,1,72,748,Rp830.000.000
https://www.lamudi.co.id/jual/jawa-barat/bandung/rumah-cantik-siap-huni-arcamanik-kota-bandung-17228279928/,rumah cantik siap huni arcamanik kota bandung,Arcamanik,,3,2,70,95,Rp900.000.000
https://www.lamudi.co.id/jual/jawa-barat/bandung/dijual-rumah-2-lantai-strategis-area-gading-regenc-172282369845/,Dijual Rumah 2 Lantai Strategis Area Gading Regency Bandung,Arcamanik,2,7,4,600,800,Rp9.500.000.000
https://www.lamudi.co.id/jual/jawa-barat/bandung/turun-harga-dijual-rumah-di-cluster-arcamanik-pasi-172276580399/,Turun harga..Dijual rumah di cluster arcamanik pasir impun Hunian Asri,Arcamanik,1,3,3,150,120,Rp1.499.000.000
https://www.lamudi.co.id/jual/jawa-barat/bandung/dijual-rumah-dalam-cluster-pasir-impun-kota-bandun-172275586014/,Dijual Rumah Dalam Cluster Pasir impun kota Bandung One Gate Sistem,Arcamanik,2,3,3,134,119,Rp1.500.000.000
https://www.lamudi.co.id/jual/jawa-barat/bandung/dijual-rumah-dan-gudang-di-jalan-raya-cisaranten-a-17227420393/,DIJUAL RUMAH DAN GUDANG DI JALAN RAYA CISARANTEN ARCAMANIK BANDUNG,Arcamanik,3,4,4,500,710,Rp6.000.000.000
https://www.lamudi.co.id/jual/jawa-barat/bandung/rumah-minimalis-2lt-siap-huni-di-arcamanik-bdg-dkt-172268153316/,Rumah Minimalis 2Lt Siap Huni di Arcamanik Bdg Dkt Jabar Sport,Arcamanik,,4,4,155,119,Rp1.300.000.000
https://www.lamudi.co.id/jual/jawa-barat/bandung/rumah-bagus-siap-huni-lokasi-strategis-arcamanik-17226772829/,Rumah Bagus Siap Huni Lokasi Strategis Arcamanik,Arcamanik,1,3,3,245,186,Rp1.300.000.000
https://www.lamudi.co.id/jual/jawa-barat/bandung/rumah-di-bawah-pasaran-arcamanik-edisi-kepepet-172267172575/,"rumah di bawah pasaran, arcamanik, edisi kepepet",Arcamanik,,7,6,500,425,Rp3.000.000.000
https://www.lamudi.co.id/jual/jawa-barat/bandung/dijual-rumah-super-luxury-172266464970/,Dijual Rumah Super Luxury,Arcamanik,,9,10,2194,1570,Rp50.000.000.000
https://www.lamudi.co.id/jual/jawa-barat/bandung/rumah-baru-siap-huni-komplek-gandasari-arcamanik-c-172264294517/,RUMAH BARU SIAP HUNI KOMPLEK GANDASARI ARCAMANIK CISARANTEN KULON,Arcamanik,1,4,3,135,96,Rp1.150.000.000
https://www.lamudi.co.id/jual/jawa-barat/bandung/di-jual-rumah-lama-murah-di-arcamanik-bandung-172264121790/,Di jual rumah lama murah di Arcamanik bandung,Arcamanik,2,4,3,250,685,Rp3.700.000.000
https://www.lamudi.co.id/jual/jawa-barat/bandung/rumah-murah-siap-huni-di-arcamanik-bandung-172263792799/,RUMAH MURAH SIAP HUNI DI ARCAMANIK BANDUNG,Arcamanik,1,2,1,60,126,Rp1.225.000.000
https://www.lamudi.co.id/jual/jawa-barat/bandung/rumah-green-caraka-residence-arcamanik-jual-cepat-172262512182/,Rumah Green Caraka Residence Arcamanik Jual Cepat Via Lelang,Arcamanik,,4,2,150,135,Rp700.000.000
https://www.lamudi.co.id/jual/jawa-barat/bandung/rumah-2-lantai-terawat-one-gate-arcamanik-172259459410/,Rumah 2 Lantai Terawat One Gate Arcamanik,Arcamanik,1,3,2,135,104,Rp1.200.000.000
https://www.lamudi.co.id/jual/jawa-barat/bandung/rumah-siap-huni-di-sayap-antapani-arcamanik-172258935463/,Rumah Siap Huni Di Sayap Antapani Arcamanik,Arcamanik,2,6,3,288,176,Rp2.500.000.000
https://www.lamudi.co.id/jual/jawa-barat/bandung/jual-rumah-baru-minimalis-komplek-cisaranten-arcam-172258107732/,JUAL RUMAH BARU MINIMALIS KOMPLEK CISARANTEN ARCAMANIK DKT ANTAPANI,Arcamanik,,3,2,70,95,Rp850.000.000
https://www.lamudi.co.id/jual/jawa-barat/bandung/rumah-full-furnished-di-arcamanik-kota-bandung-172252454793/,Rumah Full Furnished di Arcamanik Kota Bandung,Arcamanik,,4,3,150,142,Rp2.650.000.000
https://www.lamudi.co.id/jual/jawa-barat/bandung/rumah-minimalis-modern-siap-huni-di-bandung-arcama-172252151348/,"Rumah Minimalis Modern Siap Huni di Bandung, Arcamanik",Arcamanik,6,2,1,70,90,Rp960.000.000
https://www.lamudi.co.id/jual/jawa-barat/bandung/rumah-siap-huni-sayap-cisaranten-kulon-arcamanik-r-172250362420/,"Rumah Siap Huni Sayap Cisaranten Kulon, Arcamanik Ref.03802",Arcamanik,,2,2,75,100,Rp850.000.000
https://www.lamudi.co.id/jual/jawa-barat/bandung/rumah-dekat-tol-pasteur-masuk-komplek-di-komplek-a-172249749347/,Rumah dekat Tol Pasteur Masuk Komplek di Komplek Arcamanik Endah,Arcamanik,,6,4,371,477,Rp4.200.000.000
https://www.lamudi.co.id/jual/jawa-barat/bandung/rumah-murah-komplek-jl-golf-selatan-arcamanik-dkt-172248239078/,Rumah murah komplek jl golf selatan arcamanik dkt rs hermina,Arcamanik,30,4,3,200,238,Rp1.399.000.000
https://www.lamudi.co.id/jual/jawa-barat/bandung/murah-rumah-green-caraka-residence-cisaranten-inda-172243955996/,Murah Rumah Green Caraka Residence Cisaranten Indah Arcamanik,Arcamanik,,4,2,150,135,Rp700.000.000
https://www.lamudi.co.id/jual/jawa-barat/bandung/rumah-cluster-kamayangan-cingised-172242839428/,Rumah  Cluster Kamayangan Cingised,Arcamanik,,2,1,50,75,Rp748.000.000
https://www.lamudi.co.id/jual/jawa-barat/bandung/cluster-arcamanik-bukan-cisaranten-172242669867/,Cluster Arcamanik bukan Cisaranten,Arcamanik,,2,1,80,75,Rp800.000.000
https://www.lamudi.co.id/jual/jawa-barat/bandung/rumah-baru-sudah-siap-huni-cisaranten-kulon-arcama-172242273523/,Rumah Baru Sudah Siap Huni Cisaranten Kulon Arcamanik Kota Bandung SHM,Arcamanik,1,2,2,70,100,Rp850.000.000
https://www.lamudi.co.id/jual/jawa-barat/bandung/rumah-villa-mewah-plus-cafe-aktif-view-bandung-di-172241332291/,rumah villa mewah plus cafe aktif view Bandung di sindanglaya,Arcamanik,2,5,5,500,1100,Rp3.500.000.000
https://www.lamudi.co.id/jual/jawa-barat/bandung/rumah-siap-huni-di-sayap-cisaranten-kulon-arcamani-172241317534/,"Rumah Siap Huni, di Sayap Cisaranten Kulon, Arcamanik Ref.03787",Arcamanik,,3,2,70,95,Rp900.000.000
https://www.lamudi.co.id/jual/jawa-barat/bandung/rumah-siap-huni-cisaranten-kulon-arcamanik-ref-037-172241233063/,"Rumah Siap Huni, Cisaranten Kulon, Arcamanik Ref.03786",Arcamanik,,3,3,100,100,Rp1.150.000.000
https://www.lamudi.co.id/jual/jawa-barat/bandung/dijual-cepat-rumah-lt260-180-hrg1-4m-dkt-sor-arcam-172240954927/,"Dijual cepat rumah lt260/180 hrg1,4m dkt SOR Arcamanik Bandung",Arcamanik,,4,3,180,260,Rp1.400.000.000
https://www.lamudi.co.id/jual/jawa-barat/bandung/antapani-arcamanik-bandung-kota-cluster-one-gate-s-172241514773/,"Antapani Arcamanik Bandung Kota, Cluster One Gate  Sistem, Murah",Arcamanik,,2,2,126,140,Rp900.000.000
